Days til due,Amount,Scholarship Title,Due Date
241,"$10,000",Ritchie-Jennings Memorial Scholarship,02-05-2025
241,Varies,Marjorie Stonehill English Journalism and Creative Arts Scholarship,02-05-2025
241,"$8,160",WHOI Summer Student Fellowship Program,02-05-2025
242,"$30,000",Harry S. Truman Scholarship,02-06-2025
242,"$8,000",PGA WORKS John & Tamara Lundgren Scholarship,02-06-2025
242,"$7,500",Shred Nations Scholarship Program,02-06-2025
242,"$10,000","$10,000 LevelUp Gov Contest",02-06-2025
243,"$10,000",ILCA Scholarship Program,02-07-2025
243,"$3,000",Conservation Districts of Iowa Scholarships,02-07-2025
245,Varies,Bernie Smillie Memorial Scholarship - HVACR Program,02-09-2025
245,Varies,Gene and Donna Mallak Scholarship,02-09-2025
245,Varies,Saginaw Black Nurses Association Scholarship,02-09-2025
245,Varies,Pama Brantley-Phillips Scholarship,02-09-2025
245,Varies,Joe H. and Rosanne S. Gardner Scholarship,02-09-2025
245,Varies,Saginaw County Lawyers' Auxiliary Scholarship,02-09-2025
245,Varies,Judge Gary R. McDonald Memorial Scholarship,02-09-2025
245,Varies,"Brandon Walker ""BW"" Memorial Scholarships - Criminal Justice Scholarship",02-09-2025
245,Varies,Carol Doman-Wilder Scholarship,02-09-2025
245,Varies,Nexteer Scholarship,02-09-2025
245,"$3,000",RMEL Scholarships,02-09-2025
245,Varies,Flegenheimer Family Scholarship,02-09-2025
245,Varies,Albert Smith Conservation Scholarship,02-09-2025
245,Varies,UASCS Fred A. Ittner Scholarship,02-09-2025
245,Varies,"Clarence A. ""Buck"" Iles Scholarship",02-09-2025
245,Varies,Donald Stuart Corsaut Memorial Scholarship,02-09-2025
245,Varies,"Lee Essie and Charlie McMillan, Jr. Cosmetology Scholarship",02-09-2025
245,Varies,Great Lakes Safety Training Center Scholarship,02-09-2025
245,Varies,Circle Michigan Scholarship,02-09-2025
245,Varies,George William Roe Scholarship,02-09-2025
245,Varies,"Women of Colors, Inc. Scholarship",02-09-2025
245,Varies,Tom Krzyzaniak Automotive Scholarship,02-09-2025
245,Varies,Dr. Raquel Ontiveros Memorial Scholarship,02-09-2025
245,Varies,Saginaw Area Health Care Administrators Scholarship,02-09-2025
245,Varies,Mary Ellen Gase Scholarship,02-09-2025
245,Varies,Sherrill L. Smith Music Scholarship,02-09-2025
245,Varies,SCF Holland Scholarship,02-09-2025
245,Varies,Saginaw Choral Society - Joanne Robertson Memorial Scholarship,02-09-2025
245,Varies,Ruth Mitchell Hanson Scholarship,02-09-2025
245,Varies,Jerry Redeemer Memorial Scholarship,02-09-2025
245,Varies,Marlin N. & Bertha H. Wilson Memorial Scholarship,02-09-2025
245,Varies,Margaret L. Palmer Scholarship,02-09-2025
245,Varies,Gospel Fest Music Arts Scholarship,02-09-2025
245,Varies,Jerry L. Seese Ed.D Education Scholarship,02-09-2025
245,Varies,Bernie Smillie Memorial Scholarship - Medical,02-09-2025
245,Varies,"Charles E. Mueller, M.D. Scholarship",02-09-2025
245,Varies,"A.C. ""Kate"" & Leo Joseph Merlone Teaching Scholarship",02-09-2025
245,Varies,HIAS Chicago Scholarships,02-09-2025
245,Varies,Gene & Shirley Nuckolls Scholarship,02-09-2025
245,Varies,Saginaw County Association of Retired School Personnel Scholarship,02-09-2025
245,"$5,000",NAIOP Diversity Student Scholarship,02-09-2025
245,Varies,Thomas Burkhart Scholarships,02-09-2025
245,Varies,"Lee Essie and Charlie McMillan, Jr. Medical Scholarship",02-09-2025
245,Varies,Kevin W. Scott Memorial Scholarship,02-09-2025
245,Varies,Gary K. Barker Science Scholarship,02-09-2025
245,Varies,Louise Eaton Buck Art Scholarship,02-09-2025
245,Varies,Iles Family Conservation Scholarship,02-09-2025
245,Varies,Nels Andersen Scholarship,02-09-2025
245,Varies,Balcueva Family Memorial Scholarships,02-09-2025
245,"$2,500",OAB Scholarship Awards,02-09-2025
245,Varies,Steve Wagner Scholarship,02-09-2025
245,Varies,"Kenneth Hugh MacDonald Sr., Broadcasting Scholarship",02-09-2025
245,Varies,Lisa Krukowski-Whalen Nursing Scholarship,02-09-2025
245,Varies,Emma Jean Frierson Memorial Nursing Scholarship,02-09-2025
245,Varies,Cosby H. Watson Memorial Scholarship in Nursing,02-09-2025
245,Varies,Callie M. Wilson Memorial Scholarship,02-09-2025
245,Varies,Clifford H. Spicer Memorial Scholarship,02-09-2025
245,Varies,Beverly E. Hendricks Nursing Scholarship,02-09-2025
245,Varies,Tom Krzyzaniak Teaching Scholarship,02-09-2025
245,Varies,Meyer-Simon Latin Scholarship,02-09-2025
245,Varies,Robert E. Stark and Martin H. Stark Scholarship,02-09-2025
245,"$4,000",OAWWA Graduate/Adult Continuing Education Degree Scholarship,02-09-2025
245,Varies,Yellow Dog Studio Memorial Scholarship,02-09-2025
245,"$2,000",One AWWA Operator Scholarship,02-09-2025
245,"$4,000",OAWWA Undergraduate Advanced Degree Scholarship,02-09-2025
245,Varies,Louis R. and Helen E. Schwartz FFA Agricultural Scholarship,02-09-2025
245,Varies,Saginaw Social Service Club - Norman D. Osborne Memorial Scholarship,02-09-2025
245,"$20,000",Gucci Changemakers Scholarship,02-09-2025
245,Varies,E.C. Fisher Scholarship,02-09-2025
245,Varies,Paul & Deanna Virciglio Scholarship,02-09-2025
245,Varies,Donald R. McGee Memorial Scholarship,02-09-2025
245,Varies,Bud & Katherine Rae Aviation Scholarship,02-09-2025
245,Varies,Elbert Curtiss and Margaret Nienstedt Fisher Scholarship,02-09-2025
246,Varies,Y.C. Yang Civil Engineering Scholarship,02-10-2025
246,Varies,Samuel Fletcher Tapman ASCE Student Chapter Scholarship,02-10-2025
246,Varies,Lawrence W. and Francis W. Cox Scholarship,02-10-2025
246,Varies,John Lenard Civil Engineering Scholarship,02-10-2025
246,Varies,"Eugene C. Figg, Jr. Civil Engineering Scholarship",02-10-2025
246,Varies,B. Charles Tiney Memorial Scholarship,02-10-2025
246,Varies,Robert B. B. and Josephine N. Moorman Scholarship,02-10-2025
247,Varies,WCA Jo Caldwell Meyer Scholarship,02-11-2025
247,Varies,Jo Caldwell Meyer Scholarship,02-11-2025
248,Varies,The Golden Ro(a)d Designer Scholarship,02-12-2025
248,Varies,Libbie H. Hyman Memorial Scholarship,02-12-2025
248,"$4,000",ASNE Scholarship Program,02-12-2025
248,"$5,000",POET Never Satisfied Scholarship,02-12-2025
249,"$7,200",Maryland Sea Grant Undergraduate Fellowships in Estuarine Science,02-13-2025
250,"$50,000",Davidson Fellows Scholarship,02-14-2025
250,"$25,000","Danone Gut Microbiome, Yogurt and Probiotics Fellowship Grant",02-14-2025
250,"$41,588","James H. Dunn, Jr. Memorial Fellowship and Vito Marzullo Internship Program",02-14-2025
250,Varies,Washington CPA Foundation Accounting Scholarship,02-14-2025
251,"$6,000",Corporate Legal Operations Consortium Scholarship,02-15-2025
251,"$1,000",Cabot Creamery Culinary Scholarship,02-15-2025
251,"$5,000",Minnesota Masonic Charities Vocational Scholarship,02-15-2025
251,"$1,000",Vermont Police Association Scholarships,02-15-2025
251,"$8,000",Stephen W. Cavanaugh Scholarship,02-15-2025
251,"$3,000",The CRWA Annual Scholarship Program,02-15-2025
251,"$10,000",ASUS Scholarship,02-15-2025
251,Varies,Dora Maclellan Brown Ministry Scholarship,02-15-2025
251,"$6,000",Rocky Mountain Biological Lab REU Awards,02-15-2025
251,"$5,000",TAPPI Awards and Scholarships,02-15-2025
251,"$2,000",Bluegrass Realtors Post-Secondary/Trade School Scholarship,02-15-2025
251,"$60,000",ELC Scholarship Program,02-15-2025
251,"$1,000",Lee A. Lyman Memorial Music Scholarship,02-15-2025
251,"$4,000",Augustana University Fryxell Scholarship,02-15-2025
251,"$108,200",Horace Mann Fellowship,02-15-2025
251,"$1,000",Max Barrows Graduate Scholarship,02-15-2025
251,"$5,000",Jean Andrews Nursing Scholarship,02-15-2025
251,"$22,000",Vermont Dental Hygiene Scholarship,02-15-2025
251,"$320,000",W.W. Allen Boys and Girls Club Scholars Program,02-15-2025
251,"$2,000",Anne Moncrief Layman Nursing Scholarship,02-15-2025
251,"$9,460",Blandy Experimental Farm REU Program,02-15-2025
251,"$24,000",NC State Forestry and Environmental Resources Academic Scholarship,02-15-2025
251,"$2,500",NHA Past Chairs' Legacy Scholarship,02-15-2025
251,"$5,000",HSF Scholarship,02-15-2025
251,"$2,500",NDSGC Lillian Goettler Scholarship,02-15-2025
251,"$16,000",Richard T. Gates Engineering and Technology Endowed Challenge Scholarship,02-15-2025
251,"$2,500",NDSGC Pearl I. Young Scholarship,02-15-2025
251,"$80,000",Mercatus MA Fellowship,02-15-2025
251,"$1,000","Red Hawk Environmental Consulting, Ltd Scholarship",02-15-2025
251,"$4,000",Bobby Owen Memorial Scholarship,02-15-2025
251,"$3,750",NEHA/AAS Scholarship,02-15-2025
251,"$10,000",University of Utah Explore More Scholarship,02-15-2025
251,"$3,000",Florida Engineering Society High School Scholarship,02-15-2025
252,"$1,000",Missouri Corn Scholarship,02-16-2025
252,"$20,000",DGV Scholarship Program,02-16-2025
252,"$25,000",HBCU Week x AstraZeneca Scholarship,02-16-2025
252,"$2,000",Dallas Center for Architecture Foundation - McDermott Traveling Fellowship,02-16-2025
252,"$6,000",NATAS Chicago/Midwest College Scholarships,02-16-2025
253,"$14,000",UTC Westbrook Scholarship,02-17-2025
254,"$40,000",Black American Engineering Scholarship Award,02-18-2025
254,"$12,000",Hope College Distinguised Artist Awards- Creative Writing,02-18-2025
254,"$20,000",The Wes Vernon Broadcast Scholarship,02-18-2025
254,"$5,000",The Richard G. Zimmerman Scholarship,02-18-2025
254,"$12,000",Hope College Distinguished Artist Awards - Visual Arts,02-18-2025
254,"$12,000",Hope College Distinguished Artist Awards - Theatre,02-18-2025
254,"$20,000",The Scholarship for Journalism Diversity Honoring Julie Schoo,02-18-2025
255,"$1,000",Iowa Engineering Society Central Iowa Chapter Scholarship,02-19-2025
255,"$10,000",Mary Doctor Performing Arts Scholarship,02-19-2025
255,"$10,000",Gordon Hay Scholarship Fund,02-19-2025
256,Varies,American Jewish Archives Fellowship Program,02-20-2025
256,"$12,500",J & J Trujillo Memorial Scholarship,02-20-2025
257,Varies,Grattan and Stephen T. Gray Scholarship,02-21-2025
257,"$6,000",AMS Scholarship for Underserved Communities,02-21-2025
257,"$50,000",Claire M. LaPlante Engineering Scholarship,02-21-2025
258,"$1,000",Sheboygan Area- SHRM Jack Schoemer Scholarship,02-22-2025
258,"$20,000",Fukunaga Scholarship Foundation,02-22-2025
259,Varies,RISCPA Carl W. Christiansen Scholarship,02-23-2025
259,"$20,000",MathWorks Math Modeling (M3 Challenge),02-23-2025
259,"$5,000",NMTC/Bravura Scholarship for Women in STEM,02-23-2025
259,"$1,000",Gertrude M. Cox Scholarship,02-23-2025
260,"$5,000",Cameo College of Essential Beauty Tuition Scholarship,02-24-2025
260,Varies,RESNA Student Scientific Paper Competition,02-24-2025
260,"$4,000",UCLA Alice Belkin Memorial Scholarship,02-24-2025
261,"$4,000",William L. Cullison Scholarship,02-25-2025
261,"$2,500",Joseph James Morelli Legacy Foundation Scholarship,02-25-2025
261,"$2,500",Honorable William C Conner Writing Competition,02-25-2025
261,"$1,500",NASF Foundation Scholarships,02-25-2025
262,"$1,500",ASGC Undergraduate Teacher Education Scholarship,02-26-2025
262,"$5,000",ASOR Harris Excavation Grant,02-26-2025
262,"$5,000",Feeding Tomorrow Scholarships,02-26-2025
262,"$248,936",Case Western Theater Scholarship,02-26-2025
262,"$10,000",Grossman Scholarship Program,02-26-2025
262,"$5,000",AEC Aluminum Extrusion Design Competition,02-26-2025
262,"$1,500",Valero Minority Engineering Summit,02-26-2025
262,"$5,000",Thomas K. Evans Memorial Scholarship,02-26-2025
264,"$10,000",ICSC Foundation Graduate Scholarships,02-28-2025
264,"$4,500",SVCF Leo and Trinidad Sanchez Scholarship,02-28-2025
264,"$3,000",UMSA Foundation Scholarship,02-28-2025
264,"$10,000",Fly For Duke,02-28-2025
264,"$1,500",BMW/SAE Engineering Scholarship,02-28-2025
264,"$1,500",Dr. Bomi Joseph Healthcare Scholarship,02-28-2025
264,"$10,000",ICSC Scholarships,02-28-2025
264,"$5,000",SAE/Ford Partnership for Advanced Studies Scholarship,02-28-2025
264,"$26,250",Mississippi Space Grant Consortium Graduate Fellowship Program,02-28-2025
264,"$56,000",Wonderful Public Service Graduate Fellowship,02-28-2025
264,Varies,WRNS Studio Foundation Architecture Scholarship,02-28-2025
264,"$2,500",LAGRANT Foundation Undergraduate Scholarships,02-28-2025
264,"$15,000",SAE Engineering Scholarships,02-28-2025
264,"$3,750",TLF Scholarships,02-28-2025
264,"$5,000",SVCF Harold Johnson Law Enforcement Scholarship,02-28-2025
264,"$1,000",SVCF Bobette Bibo Gugliotta Memorial Scholarship for Creative Writing,02-28-2025
264,"$5,000",NCBFAA Annual Scholarship Opportunity,02-28-2025
264,"$10,000",(ISC)² Women in Information Security Scholarship,02-28-2025
264,"$5,000",(ISC)² Undergraduate Scholarships,02-28-2025
264,"$5,000",(ISC)² Graduate Cybersecurity Scholarship,02-28-2025
264,"$10,000",The Dawna J Colbert & John Fitzpatrick Scholarship,02-28-2025
264,"$22,500",Washington State Baccalaureate Scholarship,02-28-2025
264,"$3,000",Lisa Kaminski Memorial Scholarship,02-28-2025
264,"$6,500",Western Reserve Ohio Scholarship,02-28-2025
264,"$5,500",Western Reserve National Scholarship,02-28-2025
264,"$6,500",Western Reserve Herb Society Scholarships,02-28-2025
264,"$3,000",Targeting Excellence Scholarships,02-28-2025
264,"$3,000",MSPE Western Chapter Scholarship Program,02-28-2025
264,"$5,000",(ISC)² Women's Scholarship,02-28-2025
264,"$10,000",Minnesota Waste Wise Foundation Scholarship,02-28-2025
264,"$5,000",NYWEA N.G. Kaul Memorial Scholarship,02-28-2025
264,Varies,Ardell Bjugstad Scholarship,02-28-2025
264,"$5,000",Ron Collier Educational Scholarship,02-28-2025
264,"$4,000","Frederick W. Schaerf, M.D., Ph.D. Neuroscience Scholarship",02-28-2025
264,"$1,500",Tau Beta Pi/SAE Engineering Scholarship,02-28-2025
264,Varies,Society of Automotive Engineers Scholarships,02-28-2025
264,"$1,500",Shared Energy Future Foundation STEM Scholarship,02-28-2025
264,"$2,500",NCNSFPE Brady-Williamson Scholarship,02-28-2025
264,"$3,750",LAGRANT Foundation Graduate Scholarships,02-28-2025
264,"$18,000",SVCF Latinos In Technology Scholarship,02-28-2025
264,Varies,NAWIC Undergraduate Scholarship,02-28-2025
264,Varies,NAWIC Construction Trades Scholarship,02-28-2025
264,"$1,000",Spring Labroots Travel Scholarship,02-28-2025
264,"$2,500",FCI Agriculture Scholarship Program,02-28-2025
264,"$2,000",Dr. James L. and Evelyn Ribbs Hutchinson Medical Scholarship,02-28-2025
264,"$5,000",SVCF Anthony Narigi Hospitality Scholarship,02-28-2025
264,"$10,000",Mary E. Bivins Foundation Scholarships,02-28-2025
264,"$5,000",SAE Women-in-Automotive Scholarship,02-28-2025
264,"$22,500",WSOS Baccalaureate Scholarship,02-28-2025
264,"$15,000",SVCF Samsung@First Scholars,02-28-2025
264,"$1,000",Shared Energy Future Foundation Trades Scholarship,02-28-2025
264,Varies,Indian Health Service Scholarships,02-28-2025
264,"$10,000",Willard G. Plentl Sr. Aviation Scholarship,02-28-2025
264,"$9,000",Frederick R. Layton Art Scholarship,02-28-2025
264,"$2,500",Alliance Medical Education Scholarship,02-28-2025
265,"$50,000",Andy Warhol Foundation Arts Writers Grant,03-01-2025
265,"$10,000",UW Supply Chain Scholarships,03-01-2025
265,Varies,Thomas W. Jones Memorial Scholarship,03-01-2025
265,"$15,000",Datadog Upward Scholarship,03-01-2025
265,"$20,000",Central New York STEM Scholarship,03-01-2025
265,"$40,000",Society of Actuaries Hickman Scholar Program,03-01-2025
265,"$12,500",Robert D. Shapiro Memorial Scholarship,03-01-2025
265,Varies,GRCF Ladies Literary Club Scholarship,03-01-2025
265,$850,Elizabeth Garde National Scholarship,03-01-2025
265,Varies,MidMichigan Health Bailey Scholarships,03-01-2025
265,"$5,000",SEMA Memorial Scholarship Fund,03-01-2025
265,"$6,250",Columbus Citizens Foundation Dr. Anthony S. Fauci Scholarship,03-01-2025
265,Varies,Bill & Shireen Kirk Scholarship,03-01-2025
265,"$12,000",EKU Patterson Business Scholarship,03-01-2025
265,Varies,GRCF Economic Club of Grand Rapids Scholarship,03-01-2025
265,Varies,GRCF Peggy (Kommer) Novosad Scholarship,03-01-2025
265,Varies,GRCF Roger and Jacquelyn Vander Laan Family Scholarship,03-01-2025
265,Varies,GRCF Vivian M. Kommer Scholarship,03-01-2025
265,Varies,Howard and Helen Hauff Memorial Scholarship,03-01-2025
265,Varies,Iowa State University Benjamin and Patricia Allen Scholarship,03-01-2025
265,"$2,000",John M. Draughn & Trena B. Draghn Scholarship,03-01-2025
265,"$3,500",AWS James A Turner Jr Memorial Scholarship,03-01-2025
265,"$8,000",Bound to Stay Bound Books Scholarship,03-01-2025
265,"$5,000",American Library Association Spectrum Scholarship,03-01-2025
265,"$8,000",ALSC Frederic G. Melcher Scholarship,03-01-2025
265,$500,Robert L. Schulke Memorial Scholarship,03-01-2025
265,"$7,000",Indianapolis Chapter CSI Education Foundation,03-01-2025
265,"$10,000",Gensler Rising Black Designers Scholarship,03-01-2025
265,Varies,Alexander Christian Foundation Scholarships,03-01-2025
265,"$54,304",JMU Second Century STEM Scholarship,03-01-2025
265,"$1,000",TACTYC Scholarships,03-01-2025
265,Varies,Mildred E. Swakto Memorial Scholarship,03-01-2025
265,"$1,000",Missouri Bankers Foundation Scholarship Program,03-01-2025
265,"$4,000",PSGC Statewide Undergraduate Scholarship,03-01-2025
265,"$12,000",Lycoming College Creative Writing Scholarship,03-01-2025
265,"$5,300",IUMF United Methodist Seminary Scholarships,03-01-2025
265,"$1,000",Jane C. Waldbaum Archaeological Field School Scholarship,03-01-2025
265,"$5,000",ALA Christopher J. Hoy/ERT Scholarship,03-01-2025
265,"$2,500",Beauty & Wellness Professionals Scholarship,03-01-2025
265,Varies,Iowa Automobile Dealers Foundation for Education Scholarship,03-01-2025
265,"$3,000",ALA David H. Clift Scholarship,03-01-2025
265,"$3,000",ALA Mary V. Gaver Scholarship,03-01-2025
265,"$112,544",Eureka College Disciples Leadership Program,03-01-2025
265,"$3,000",ALA Miriam L. Hornback Scholarship,03-01-2025
265,"$3,000",ALA Tom & Roberta Drewes Scholarship,03-01-2025
265,"$3,000",ALA Tony B. Leisner Scholarship,03-01-2025
265,"$2,000",Mac Hyde Brownfield Scholarship Program,03-01-2025
265,"$2,000",GRCF Economic Club Business Study Abroad Scholarship,03-01-2025
265,"$4,000",Ruth F. Wallace Scholarship,03-01-2025
265,Varies,James B. Simpson Fellowship,03-01-2025
265,"$5,000","The Rubber Division, ACS Undergraduate Scholarship",03-01-2025
265,"$2,000",Alex Newton Scholarship,03-01-2025
265,"$10,000",The Nikon Storytellers Scholarship,03-01-2025
265,Varies,Spirit Square Center for Arts and Education Scholarship,03-01-2025
265,"$4,000",Master of Fine Arts Scholarship Competition and Exhibition,03-01-2025
265,"$12,000",Lycoming College Talent Scholarships,03-01-2025
265,Varies,GRCF Paul Collins Scholarship,03-01-2025
265,Varies,GRCF Mathilda & Carolyn Gallmeyer Scholarship,03-01-2025
265,Varies,GRCF Arts Council of Greater Grand Rapids Minority Scholarship,03-01-2025
265,"$8,000",TxDOT Conditional Grant Program,03-01-2025
265,"$3,000","West Virginia Engineering, Science and Technology Scholarship",03-01-2025
265,"$201,600",Ripon College Knop Science Scholars Program,03-01-2025
265,"$2,500",Dorian De Long Arts & Music Scholarship,03-01-2025
265,"$10,000",Dr. Abdus Saleem Family Scholarship,03-01-2025
265,"$2,000",Women's Overseas Service League Scholarships,03-01-2025
265,Varies,Illinois AMVETS Sad Sacks Nursing Scholarship,03-01-2025
265,"$5,000",MMUF Travel & Research Grants,03-01-2025
265,"$1,000",Rocky Mountain Coal Mining Technical School Scholarship,03-01-2025
265,"$40,000",Diversify the Future STEM Scholarship,03-01-2025
265,"$2,500",Edward C. Bryant Scholarship,03-01-2025
265,"$80,000",University of Michigan Bell Scholarship,03-01-2025
265,$500,Veterinary Technology Scholarships,03-01-2025
265,"$1,000",Undergraduate Companion Animal Interest Scholarship,03-01-2025
265,"$2,000",Oxbow Animal Health Scholarships,03-01-2025
265,Varies,"GRCF Dr. Noyes L. Avery, Jr. & Ann E. Avery Scholarship",03-01-2025
265,"$3,000",Oklahoma Christian University Current Student Biblical Studies Scholarship,03-01-2025
265,"$20,000",Goya Foods Culinary Arts Scholarship Program,03-01-2025
265,Varies,Manatee County Medical Education Scholarship,03-01-2025
265,"$5,000",Abdo Diverse Accounting Student Scholarship & Internship,03-01-2025
265,"$1,000",Arnold W. Fritz Scholarship,03-01-2025
265,"$4,000",SMUD Powering Futures Scholarship,03-01-2025
265,"$2,500",Matsuo Bridge Company Ltd. of Japan Scholarship,03-01-2025
265,"$2,500",AWS Arsham Amirikian Welding Scholarship,03-01-2025
265,"$2,000",Advocates for African Americans Carolinas Scholarship,03-01-2025
265,"$1,000",Asama Coldwater Manufacturing (ACM) Georgia Scholarship,03-01-2025
265,Varies,Brian Kershaw Memorial Scholarship,03-01-2025
265,Varies,Carolina Panthers Graduate Scholarship,03-01-2025
265,Varies,CCU Music Scholarships,03-01-2025
265,"$65,536",Curtis Institute of Music/Tuition Scholarships,03-01-2025
265,Varies,Gold Coast Jazz Society's Jeanette M. Russell Scholarship Fund,03-01-2025
265,Varies,GRCF Guy D. and Mary Edith Halladay Music Scholarship,03-01-2025
265,Varies,GRCF Llewellyn L. Cayvan String Instrument Scholarship,03-01-2025
265,"$5,000",USCTI Scholarship Program,03-01-2025
265,Varies,GRCF Mildred E. Troske Music Scholarship,03-01-2025
265,"$1,000",Nebraska High School Senior Scholarship,03-01-2025
265,"$1,500",World Trade Week Scholarship,03-01-2025
265,"$10,000",Stephen K. Hall ACWA Water Law & Policy Scholarship,03-01-2025
265,"$20,000",Connecticut Building Congress Scholarships,03-01-2025
265,"$5,000",GRCF Miller Johnson Michigan Diversity Law School Scholarship,03-01-2025
265,"$1,800",Indianapolis Bureau of Jewish Education Jewish Studies Scholarship,03-01-2025
265,"$2,500",John Deere Dealer Scholarship Program,03-01-2025
265,"$3,500",AWS John C. Lincoln Memorial Scholarship,03-01-2025
265,"$2,500",AWS Howard E. and Wilma J. Adkins Memorial Scholarship,03-01-2025
265,"$2,500",AWS Edward J. Brady Memorial Scholarship,03-01-2025
265,"$2,500",AWS Airgas Terry Jarvis Memorial Scholarship,03-01-2025
265,"$1,500","Sander Cohen Scholarship Foundation, Inc",03-01-2025
265,Varies,"GRCF Harry J. Morris, Jr. Emergency Services Scholarship",03-01-2025
265,"$5,000",Rocky Mountain Coal Mining Engineering/Geology Scholarship,03-01-2025
265,"$2,500",AWS Barbara and Richard Couch Hypertherm Scholarship,03-01-2025
265,"$1,000",Al Neuharth Free Spirit and Journalism Conference,03-01-2025
265,"$5,000",Marin County Bar Association Legal Scholarship,03-01-2025
265,Varies,GRCF Violet Wondergem Health Science Scholarship,03-01-2025
265,"$24,000",James Madison Graduate Fellowships,03-01-2025
265,"$2,500",AWS William B. Howell Memorial Scholarship,03-01-2025
265,Varies,GRCF Rosemary Cook Education Scholarship,03-01-2025
265,Varies,GRCF John T. and Frances J. Maghielse Scholarship,03-01-2025
265,Varies,GRCF Audrey L. Wright Scholarship,03-01-2025
265,"$2,000",Gritman Scholarships,03-01-2025
265,Varies,Gensler Brinkmann Scholarship,03-01-2025
265,"$30,000",PAFMG Annual Pre-Med Scholarship Awards,03-01-2025
265,Varies,GFWC Massachusetts Catherine E. Philbin Scholarship,03-01-2025
265,Varies,"GRCF Armando ""Frank"" Quaglia Veteran's Scholarship",03-01-2025
265,"$2,500",AWS Praxair International Scholarship,03-01-2025
265,"$2,500",PNW Retail Group Scholarship,03-01-2025
265,$500,Marki Lemons Ryhal Education Advancement Scholarship,03-01-2025
265,"$2,500",Kinder Institute Scholarship,03-01-2025
265,"$2,500",AWS Donald F Hastings Scholarship,03-01-2025
265,"$2,500",AWS Airgas Jerry Baker Scholarship,03-01-2025
265,"$5,000",Aero Club Foundation of Washington Scholarship,03-01-2025
265,"$1,000",Iowa Funeral Directors Association Scholarships,03-01-2025
265,$750,IFDA James R. Corson Scholarship,03-01-2025
265,"$1,000",IFDA Jack G. Dodds Scholarship,03-01-2025
265,"$3,000",GFWC Massachusetts Memorial Education Scholarship for Graduate Studies,03-01-2025
265,"$20,000",Banatao Family Filipino American Education Fund,03-01-2025
265,"$3,000",ALA LITA/Christian Larew Memorial Scholarship,03-01-2025
265,"$1,500",Marian Othmer Schultz Scholarship,03-01-2025
265,"$49,000",Noyce Teaching Fellowship for Career Changers,03-01-2025
265,"$1,000",Big Game Conservation Association Scholarship,03-01-2025
265,Varies,GRCF Aim High Jerry Clay Scholarship,03-01-2025
265,Varies,EAA Post-Secondary Scholarships,03-01-2025
265,"$1,000","Edsel J ""Coupe"" DeVille Memorial Scholarship",03-01-2025
265,Varies,GRCF Joshua Esch Mitchell Aviation Scholarship,03-01-2025
265,"$2,500",Sertoma Club of Springfield Scholarship,03-01-2025
265,Varies,GRCF Virginia Valk Fehsenfeld Scholarship,03-01-2025
265,"$2,500",Northwest Farm Credit Services Land Grant Scholarship,03-01-2025
265,Varies,USDA 1890 National Scholars Program,03-01-2025
265,"$4,000",TAIA Dick Laursen Memorial Scholarship,03-01-2025
265,Varies,Roy Farms Scholarship,03-01-2025
265,Varies,Phil Jenkins Memorial Scholarship,03-01-2025
265,"$2,500",Northwest Farm Credit Services Minority Scholarship,03-01-2025
265,"$1,250",A. F. Zimmerman Scholarship,03-01-2025
265,"$2,000",Oxbow Animal Health Veterinary Medicine Scholarship,03-01-2025
265,"$1,500",New York Farm Bureau AG Youth Scholarship,03-01-2025
265,"$1,000",Lynn Buerki Memorial Scholarship,03-01-2025
265,Varies,Valent USA Tree Fruit Scholarship,03-01-2025
265,"$8,000",WAEF Scholarships,03-01-2025
265,Varies,Alaska Bar Association Law School Scholarships,03-01-2025
265,"$1,000",Robert Miller Scholarship,03-01-2025
265,"$1,000",Future Dental Professional Scholarships,03-01-2025
265,Varies,Vincent and Catherine Sansalone Scholarship,03-01-2025
265,"$3,500",Association of California Water Agencies Scholarship,03-01-2025
265,"$2,000",Charlie C. Turman Scholarship,03-01-2025
265,"$5,000",Clair A. Hill Scholarship,03-01-2025
265,"$10,000",SEG Scholarships,03-01-2025
265,"$5,000",Austin Alliance for Women in Media Scholarship,03-01-2025
