Days til due,Amount,Scholarship Title,Due Date
0,"$5,000",Reason One Mentorship and Scholarship Program,06-09-2024
0,"$1,500",Desire to Inspire Scholarship,06-09-2024
0,"$3,000",Kentucky Nursing Incentive Scholarship Fund,06-08-2024
1,"$5,000",Joseph Zukin Jr. Scholarship For Entrepreneurship,06-10-2024
3,"$10,000","Anarcha, Betsy, and Lucy Memorial Scholarship Award",06-12-2024
4,"$5,000",Global Atlantic Scholarship Program,06-13-2024
5,"$2,000",Singhaus Scholarship for the Performing Arts,06-14-2024
5,Varies,Genesis Healthcare Foundation Scholarships,06-14-2024
5,"$2,000",APA Tom Cory Scholarship,06-14-2024
5,"$2,000",Marion Dorroh Memorial Scholarship,06-14-2024
5,"$1,000",AMS Father James B. Macelwane Award,06-14-2024
5,"$20,000",Women in Finance Scholarship,06-14-2024
5,"$10,000",National Potato Council Scholarship,06-14-2024
5,"$10,000",Tech for Mental Health Scholarship,06-14-2024
6,"$1,000",Spark For the Future Scholarship,06-15-2024
6,"$5,000",CREW Greater Philadelphia Scholarship,06-15-2024
6,"$1,500",ISSAEF George “Chip” Meadows Memorial Scholarship,06-15-2024
6,"$3,500","ISSAEF E. Eugene Schultz, Jr., Memorial Scholarship for graduate studies",06-15-2024
6,"$5,000",Delaware Educator Support Scholarship,06-15-2024
6,"$1,000",Donald F. & Mildred Topp Othmer Scholarship Awards,06-15-2024
6,"$5,000",John J. McKetta Undergraduate Scholarship,06-15-2024
6,"$4,000",EPA Tribal Lands Environmental Science Scholarship,06-15-2024
6,$500,NCSCLS Student Scholarship Fund,06-15-2024
6,Varies,ASCLS- MN Scholarship,06-15-2024
6,"$16,000",International Pacific Halibut Commission Merit Scholarship,06-15-2024
6,"$3,500",ISSAEF Howard A. Schmidt Memorial Undergraduate Scholarship,06-15-2024
6,"$5,000",Mid-Atlantic STA Foundation Scholarship,06-15-2024
6,"$2,000",Josh Gottheil Memorial Stem Cell Transplant Career Development Award,06-15-2024
6,"$2,000",ISSAEF Shon Harris WIS (Women in Security) Memorial Scholarship,06-15-2024
6,"$1,000",Zonta Club Women in STEM Scholarship,06-15-2024
6,"$15,000",AICPA Fellowships for Doctoral Students,06-15-2024
6,"$5,000",Zonta Club Jane M Klausman Women in Business Scholarship,06-15-2024
7,$500,MOGA Energy Education for Michigan Scholarships,06-16-2024
7,$750,Nola Cook Scholarship,06-16-2024
7,$750,Martha J. Branch Scholarship,06-16-2024
8,"$5,000",WiT Foundation Scholarship,06-17-2024
8,"$17,800",Reading Hospital Scholarships,06-17-2024
9,"$5,000",Women in Aerospace Foundation Scholarship,06-18-2024
11,"$30,000",Child Development Division College Coursework Scholarship,06-20-2024
12,"$1,000",Los Angeles Hispanic PR Association Scholarship,06-21-2024
12,Varies,Tuition Waiver for Online Seminary Courses (Master's in Divinity),06-21-2024
12,"$10,000",I/ITSEC Postgraduate Scholarship,06-21-2024
14,"$5,000",Jeff Sessions Memorial Scholarship,06-23-2024
15,"$5,000",NASA Iowa Space Grant Consortium Scholarship,06-24-2024
19,"$2,500",Navigate Your Future Scholarship,06-28-2024
19,Varies,AIA Central Massachusetts Scholarship,06-28-2024
19,"$2,500",Metal Supermarkets Trade School Scholarship,06-28-2024
19,$500,Mel C. Marshall Student Scholarship,06-28-2024
19,"$3,000",WSHA Student Scholarships,06-28-2024
21,$500,National Military Fish and Wildlife Association Scholarship,06-30-2024
21,"$2,000",Power Life Sciences Scholarship,06-30-2024
21,"$1,000",IAAI Scholarship Foundation Accounting Scholarships,06-30-2024
21,"$15,000",Phoenix Capital Group Scholarship,06-30-2024
21,"$1,000",Kelly Somey Digital Marketing Scholarship,06-30-2024
21,"$2,000",The Home Depot Foundation Path to Pro Scholarship,06-30-2024
21,"$5,000",The Kyle Robinson Memorial Scholarship,06-30-2024
21,"$8,400",Foundation for Louisiana Armature Scholarship,06-30-2024
21,"$5,000",L. Ron Hubbard Illustrators of The Future Contest,06-30-2024
21,"$25,000",CIA Graduate Program Scholarship,06-30-2024
21,"$10,000",HSVMA Compassionate Care Veterinary Student Scholarship,06-30-2024
21,$500,Golden State Nursing Foundation BSN Scholarship,06-30-2024
21,"$1,200",Frank and Brennie Morgan Prize,06-30-2024
21,"$6,000",Construction Roundtable of New Jersey,06-30-2024
21,"$1,500",Hajja Razia Sharif Sheikh Scholarship,06-30-2024
21,"$1,000",Avisen Legal’s Business Law Scholarship,06-30-2024
21,"$80,864",Berklee Merit-Based Scholarships,06-30-2024
21,"$5,000",Media Fellows Scholarship,06-30-2024
21,"$5,000",Women in Public Finance Scholarship,06-30-2024
21,"$2,500","IAEE Diversity, Equity and Inclusion Scholarship",06-30-2024
21,"$1,000",Uncensored Scholarship,06-30-2024
21,Varies,Automotive Hall of Fame Scholarships,06-30-2024
21,"$3,000",BRAF Paul F. Brown Scholarship,06-30-2024
21,"$2,500",SCMA Scholarship,06-30-2024
21,"$1,500",Frank and Agnes Campbell Scholarship,06-30-2024
21,"$1,500",ULSCA Supply Chain Scholarship,06-30-2024
22,"$1,500",Bryant Gladney Paramedic Education Scholarship,07-01-2024
22,Varies,NFPA Student Scholarship,07-01-2024
22,"$5,000",Leading Light Awards and Scholarship,07-01-2024
22,"$2,500",Extensiv Supply Chain Scholarship,07-01-2024
22,"$1,000",David F. Ludwig Memorial Student Travel Scholarship,07-01-2024
22,"$10,000",MBA Changemakers Scholarship,07-01-2024
22,"$5,000",Cindy Finley Memorial Scholarship (CFMS) to Support Women in the Packaging Industry,07-01-2024
22,"$1,000",Women in STEM Academic Scholarship,07-01-2024
22,"$1,000",Dr. Michael E Miller Student Competition Scholarship,07-01-2024
22,"$1,500",Elmer Carvey Scholarship,07-01-2024
22,"$1,000",SEAFWA’s Law Enforcement Chief’s Scholarship,07-01-2024
22,"$1,000",HCBA Colonel Archer B. Battista Veterans Scholarship,07-01-2024
22,"$1,000",Dr. Charlena M. Seymour Scholarship,07-01-2024
22,"$2,000",New Tracks Modeling Mentoring Scholarship,07-01-2024
22,"$4,000",Workforce Shortage Student Assistance Grant Program,07-01-2024
22,"$12,000",Rockefeller State Wildlife Scholarship,07-01-2024
22,"$2,500",CFESA Cares Scholarship,07-01-2024
22,"$1,000",ImVein Healthcare Scholarship,07-01-2024
22,Varies,Arkansas Health Education Grant (ARHEG),07-01-2024
22,Varies,SSVMS Medical Student Scholarship Fund,07-01-2024
26,"$2,500",Mike Molino RV Learning Center's Scholarship Program,07-05-2024
27,"$3,000",Shelving.com Business Scholarship,07-06-2024
28,Varies,Flight Attendants/Flight Technicians Scholarship,07-07-2024
28,"$2,500",YPE SF Bay Area Scholarship,07-07-2024
29,"$8,000",The Rick and Sherry Murray Medical Futures Scholarship,07-08-2024
29,"$2,000",SMRPCO Dorothy and Jack Nicholas Scholarship,07-08-2024
29,"$2,000",SMRP Scholarship,07-08-2024
31,"$5,000",Sharon Stephens Brehm Undergraduate Psychology Scholarships,07-10-2024
33,"$1,000",Crystal Group Innovation Scholarship,07-12-2024
33,"$1,000",Michael J. Lightfoot Legacy Scholarship,07-12-2024
33,"$3,000",MyHeart Scholarship,07-12-2024
33,"$1,000",MFMA Academic Scholarship,07-12-2024
33,"$2,000",GeneTex Scholarship Program,07-12-2024
35,"$3,000",CFMA Portland Chapter Scholarship,07-14-2024
35,"$6,000",Chiropractic Education Scholarship Program,07-14-2024
36,"$1,000",Quatrefoil Library Scholarship,07-15-2024
36,"$1,500",Shade Sail Design Challenge Scholarship,07-15-2024
36,Varies,David A. Ladizki Scholarship,07-15-2024
36,Varies,John F. Moriarty Scholarship,07-15-2024
36,$500,Elevate Scholarship Program,07-15-2024
36,Varies,Bill H. James Foundation for Aspiring African American Engineers,07-15-2024
36,Varies,Ministerial Financial Assistance from the BGCT,07-15-2024
36,"$1,000",Kevin L. Allen Memorial Scholarship,07-15-2024
36,$500,CABMET Scholarship,07-15-2024
36,Varies,Hardin-Simmons University Endowed Scholarships for Ministerial Students,07-15-2024
36,"$3,000",Khyentse Foundation Buddhist Studies Scholarships,07-15-2024
36,"$5,000",Khyentse Foundation Individual Practice Grants,07-15-2024
36,Varies,Dr. Pete Magee Memorial Scholarship,07-15-2024
36,"$5,000",Khyentse Foundation PhD Scholarships,07-15-2024
38,"$2,500",Donovan Kayne Lujan Memorial Fund Scholarship,07-17-2024
41,"$2,500",Joy Cappel Scholarship,07-20-2024
41,"$1,000",Antibodies-Online Annual University Scholarship,07-20-2024
41,"$4,000",MWISM Foundation Scholarship,07-20-2024
43,"$1,000",Jacqueline Duty Memorial Scholarship,07-22-2024
43,"$2,500",Greater St. Louis Association of Black Journalists' Summer Scholarship,07-22-2024
47,"$12,000",CIAM Academic Excellence Scholarship,07-26-2024
51,"$1,000",Anders Scholarship,07-30-2024
51,Varies,Loyola University Chicago Rule of Law Scholarship,07-30-2024
51,"$1,000","Anders $1,000 Scholarship",07-30-2024
52,$500,PestNet Future Entomologist Scholarship,07-31-2024
52,"$2,000",AKC Humane Fund John D. Spurling Scholarship,07-31-2024
52,"$5,000",Alaska Airmen Scholarships,07-31-2024
52,"$3,000",BRAF David and Jeannie Price Scholarship,07-31-2024
52,"$5,000","""Pass the Torch"" Teacher Scholarships",07-31-2024
52,"$2,500",IABA Foundation Scholarships,07-31-2024
52,"$5,000",New Silver Fintech Scholarship,07-31-2024
52,"$10,000",PHF Reagan Sloane Shanley Scholarship,07-31-2024
52,"$1,000",Walkin’ Pets Veterinarian & Rehab/Vet Tech Scholarships,07-31-2024
52,"$1,000",Fall Labroots Undergraduate Back-To-School Scholarship,07-31-2024
52,"$30,000",ForEverglades Scholarships,07-31-2024
52,"$1,000",Fall Labroots Graduate Research Scholarship,07-31-2024
52,"$2,000",Alegria by PG Lite Nursing Scholarship,07-31-2024
52,$500,Cavalier Trail Riding Club Scholarship,07-31-2024
52,"$2,000",Barbara Caras Memorial Scholarship for Film Studies,07-31-2024
52,"$5,000",Women of the Vine & Spirits Foundation Student Educational Scholarship,07-31-2024
52,"$1,000",Notes on Freedom Scholarship,07-31-2024
52,"$1,000",Beth E. Marcus Scholarship Fund,07-31-2024
52,"$5,000",Emerson Discrete Automation Scholarship,07-31-2024
53,"$3,000",LoopEd STEM and Real Estate Scholarships,08-01-2024
53,"$1,000",Elizabeth M. Mauro Reimbursement Program,08-01-2024
53,"$20,000",LUC Paul D. Coverdell Fellowships,08-01-2024
53,"$7,500",Felbry College of Nursing Scholarship,08-01-2024
53,"$1,000",Skillionaire Games Scholarship: RadLabSC,08-01-2024
53,"$33,750",Mosaic Ministries Scholarship,08-01-2024
53,"$2,500",HWA Scholarships,08-01-2024
53,"$10,000",TYLENOL Future Care Scholarship,08-01-2024
53,"$4,000",Minority Teacher Education Scholarship,08-01-2024
53,"$2,250",WSEMA Scholarship Program,08-01-2024
53,"$1,500",Michael Moody Fitness Scholarship,08-01-2024
53,"$5,000",The Mahoney Family Foundation Scholarship,08-01-2024
53,"$2,500",Wang Ji Thong Family Scholarship,08-01-2024
53,"$7,500",Paraprofessional Teacher Preparation Grant Program,08-01-2024
54,Varies,Leon M. Poe Scholarship,08-02-2024
56,"$2,500",SAS Clean Air Scholarship,08-04-2024
56,"$5,000",GMiS California Medical Scholarships,08-04-2024
58,"$1,000",We Art Scholarship,08-06-2024
59,$250,Pheabs Finance Scholarship Award,08-07-2024
61,"$5,000",USRA Distinguished Undergraduate Awards,08-09-2024
63,"$2,000",Florida Stormwater Association Scholarship Award,08-11-2024
63,"$1,000",GAEP Environmental Scholarship,08-11-2024
66,"$15,000",UNCF Chevron Corporate Scholars Program,08-14-2024
66,"$1,000",Nancy Hall Memorial Scholarship,08-14-2024
67,"$5,000",Santa Rosa Ninety-Nines Aviation Scholarship,08-15-2024
67,"$1,000",Marketing/Public Relations Scholarship,08-15-2024
67,"$1,000",Calvin L. Carrithers Aviation Scholarship,08-15-2024
67,"$1,000",IJA Strategies Women in Technology Scholarship,08-15-2024
67,"$10,000",CWGCS Fellowship on Women & Public Policy,08-15-2024
69,"$2,500",Arizona Nurses Foundation Academic Nursing Scholarships,08-17-2024
69,"$43,000",NSF-Navy Civilian Service Fellowship-Scholarship,08-17-2024
70,"$10,000",American College of Surgeons International Guest Scholarships,08-18-2024
70,"$1,000",Mrs. Prindables Future Educator Scholarship,08-18-2024
74,Varies,Drexel MFA Gift Fund For Marginalized Writers,08-22-2024
75,"$1,000",Western Colorado Horticultural Society Scholarship,08-23-2024
77,"$1,000",Castagra Roofing Scholarship,08-25-2024
78,Varies,National Association of Women in Construction,08-26-2024
80,"$1,000",NOPHNRCSE Scholarships,08-28-2024
80,"$10,000",KnowBe4 Military Veterans & Spouses Cybersecurity Scholarship,08-28-2024
82,"$1,500",VPMA Statewide Scholarship,08-30-2024
82,Varies,VPMA Virginia Tech Entomology Scholarship,08-30-2024
83,"$25,000",White Coat Investor Scholarship,08-31-2024
83,"$1,500",Lucille Stoeppler Baker Scholarship,08-31-2024
83,"$15,000",Arnold M. Miller “Find A Way” Scholarship,08-31-2024
83,"$10,000",Trial LawHER Scholarship for Female Law Students,08-31-2024
83,"$1,000",Phoenix AISES Scholarship,08-31-2024
83,"$1,000","Kenneth E. Hasbrouck, Sr. History Scholarship",08-31-2024
83,Varies,William A. Crawford Minority Teacher Scholarship,08-31-2024
83,Varies,Tien Bui Memorial Scholarship,08-31-2024
83,"$5,000",L’Ore´al LGBTQIA+ Scholarship,08-31-2024
83,"$1,000",CDPAP Department of Edison HHC Educational Scholarship,08-31-2024
83,"$1,000",NACIS Student Scholarship in Cartography,08-31-2024
83,"$1,000",Charles J. Hasbrouck Memorial Scholarship,08-31-2024
83,$750,PATCH Scholarship Program,08-31-2024
83,"$2,000",Preventive Measures Legacy Scholarship,08-31-2024
84,"$2,500",American Board of Funeral Service Education - National Scholarship,09-01-2024
84,"$12,500",Utom River Conservation Fund Fellowship,09-01-2024
84,"$5,000",Anthony P. Aslanian Hospitality Scholarship,09-01-2024
84,Varies,Serbian Bar Association of America Scholarship,09-01-2024
84,"$2,500",Undergraduate Interior Design Scholarship,09-01-2024
84,"$2,500",Graduate Interior Design Scholarship,09-01-2024
84,"$1,500",SPALS Scholarships,09-01-2024
84,"$1,000",Beldon Scholarship,09-01-2024
84,Varies,Worcester District Medical Society Scholarship,09-01-2024
84,"$10,000",GTI Taiwan Scholarship,09-01-2024
84,"$3,000",Polonia Institute Historical Scholarship Competition,09-01-2024
85,"$10,000",ESP Rock Guitar Scholarship,09-02-2024
86,Varies,OFDA Scholarships,09-03-2024
87,"$2,500",LimNexus Scholarship,09-04-2024
89,"$1,500",Gordon Paesani Scholarship,09-06-2024
89,"$2,500",Net Solutions Scholarship,09-06-2024
91,"$1,000",AEP Diversity in the Environmental Profession Student Scholarship,09-08-2024
92,"$5,000",Wayne Anthony Butts Scholarship,09-09-2024
92,"$1,000",Harold and Muriel Berkman Marketing Scholarship,09-09-2024
92,"$20,000",Future Clinicians Scholarship,09-09-2024
93,"$1,000",Justin Magnuson Justice Reform Foundation Scholarship,09-10-2024
93,"$1,000",World Trade Association of Philadelphia Scholarship Program,09-10-2024
96,"$1,000",Jay Holstine STEM Scholarship,09-13-2024
98,"$1,000",CUSABIO Biotechnology Scholarships 2023,09-15-2024
98,"$5,000","Theodore Gordon Flyfishers, Inc. Founders Fund Scholarship",09-15-2024
98,"$2,500",Stephen Rice Memorial Fund Scholarship for GLBT Media,09-15-2024
98,"$1,000",J.C. Cote Scholarship,09-15-2024
98,Varies,Alaska Space Grant Program- Undergraduate,09-15-2024
105,"$7,800",New Futures Scholars Program,09-22-2024
105,"$5,000",John Conley Ethics Essay Contest,09-22-2024
105,Varies,MBTA Educational Foundation Scholarships,09-22-2024
106,"$10,000",Rose Bowl Game Keith Jackson Postgraduate Scholarship,09-23-2024
108,"$15,000",Lemelson-MIT Student Prize,09-25-2024
112,"$2,500",Tedric A. Harris Bearing Internship Scholarship,09-29-2024
112,"$5,000",D.O.O.R.S Diversification Of Our Research Scientists,09-29-2024
112,"$5,000",AOTF Scholarships,09-29-2024
112,"$10,000",John J. Nelson Sr. Legacy Scholarship,09-29-2024
113,"$2,000","Myrtle Siegfried, MD and Michael Vigilante, MD Scholarship Fund",09-30-2024
113,"$1,500","Scott A. Gunder, MD, DCMS Presidential Scholarship",09-30-2024
113,"$1,000",Creative Biolabs Scholarship Program,09-30-2024
113,"$5,000",Heartfelt Dreams Foundation Nursing Scholarship,09-30-2024
113,"$2,500",AASA Education Administration Scholarship,09-30-2024
113,"$5,000",Be the Change the Veterinary Profession Needs Scholarship,09-30-2024
113,"$5,000",Georgia Engineering Foundation Scholarships,09-30-2024
113,"$2,500",Montgomery County Medical Society (MCMS) Scholarship,09-30-2024
113,"$2,000",Lycoming County Medical Society Scholarship,09-30-2024
113,"$5,000",Endowment for South Asian Students of Indian Descent Scholarship,09-30-2024
113,"$4,000",Allegheny County Medical Society Medical Student Scholarship,09-30-2024
113,"$1,000",Plains Anthropology Society Native American Student Award,09-30-2024
113,Varies,Ph.D. Scholarship in Sustainable Computing at Edge-Cloud Continuum,09-30-2024
114,"$1,000",Proffitt Brewer Scholarship,10-01-2024
114,$500,Chicago Culinary Museum and Chef’s Hall of Fame Scholarship,10-01-2024
114,"$25,000",Music for Youth Foundation Awards,10-01-2024
114,"$2,500",Blue Cross Blue Shield ND Caring Foundation Scholarship,10-01-2024
114,"$30,000",Golden Door Scholars,10-01-2024
114,"$1,000",ATE Ballistic Helmet Scholarship Fund,10-01-2024
114,"$3,000",AWWA Academic Achievement Awards,10-01-2024
114,"$24,000","William D. Clarke, Sr. Diplomatic Security (Clarke DS) Fellowship Program",10-01-2024
114,"$1,500",NurseDeck Go,10-01-2024
114,"$1,000",Dick Lauber Masonry Scholarship,10-01-2024
114,Varies,Chips Quinn Scholars Program,10-01-2024
114,Varies,Good Samaritan Foundation Scholarships,10-01-2024
114,"$20,000",Epic Flight Academy Aviation Scholarship,10-01-2024
114,"$2,000",Rees Scholarship Foundation — HVACR and Water Heating Technician Program,10-01-2024
115,"$12,000",Association for Iron & Steel Technology Scholarships,10-02-2024
118,"$15,000",Craft Research Fund Grants,10-05-2024
119,"$5,000",PLNA Foundation Scholarship Program,10-06-2024
119,"$10,000",Albers-Alexander LGBTQ Law Scholarship,10-06-2024
119,"$3,000",LeCoMASE Fund Scholarship,10-06-2024
120,"$3,000",WSGC Undergraduate Scholarship,10-07-2024
123,Varies,NETTCP Multiple Scholarships,10-10-2024
124,Varies,Walt Disney Imaginations Design Competition Project Challenge,10-11-2024
125,"$2,500",Ludo Frevel Crystallography Scholarship,10-12-2024
126,"$5,000",Woodrow Wilson Dissertation Fellowship in Women’s Studies,10-13-2024
126,"$1,000",BEA Edward O. Fritts Award,10-13-2024
126,"$12,000","Rossiter Family Scholarship On Behalf of William J. Rizzo, Jr.",10-13-2024
126,"$4,000",BEA Richard Eaton Foundation Award,10-13-2024
126,"$40,000",AAA Graduate Education Scholarships (USA to Australia),10-13-2024
126,"$1,500",BEA Founders Award,10-13-2024
126,"$10,000",Stantec Equity & Diversity Scholarship,10-13-2024
126,"$3,500",BEA John Bayliss Award,10-13-2024
126,"$3,000",BEA Abe Voron Award,10-13-2024
126,"$3,000",BEA Library of American Broadcasting Foundation Award,10-13-2024
126,"$4,000",BEA Vincent T. Wasilewski Award,10-13-2024
126,"$3,500",BEA Peter B. Orlik Award,10-13-2024
127,"$2,500",Mechanical One Scholarship,10-14-2024
128,Varies,WICHE Professional Student Exchange Program,10-15-2024
128,"$1,000",SHAPE America Bill Kane Undergraduate Scholarship,10-15-2024
128,"$1,000",GHF Emerge Scholarship,10-15-2024
128,"$1,000",OHM Advisors Diversity Scholarship,10-15-2024
128,"$2,000",Utom Conservation Fund,10-15-2024
128,"$1,500",Big Blanket Dream Big Scholarship,10-15-2024
128,"$5,000",Women's Transportation Seminar (WTS) Colorado Chapter Scholarships,10-15-2024
128,"$12,000",Early Career Fellowships in Hellenic Studies,10-15-2024
128,"$5,000",SVC Foundation College Scholarship,10-15-2024
128,"$70,000",American Cancer Society Postdoctoral Fellowships,10-15-2024
128,"$25,000",CHS Fellowships in Hellenic Studies,10-15-2024
128,Varies,Nebraska Veterinary Medical Association Scholarships,10-15-2024
128,"$2,500",RIVMA Veterinary Student Scholarship,10-15-2024
129,"$2,500",Sargenti Scholarship + Experience,10-16-2024
129,"$2,000",Hawaii Association of Public Accountants Scholarship,10-16-2024
129,"$7,500",FSF Case Study Scholarship,10-16-2024
129,Varies,Luce Scholars Program,10-16-2024
134,"$1,500",WSOS Career and Technical Scholarship,10-21-2024
134,"$20,000",NBCC Minority Fellowship Program for Mental Health Counselors (Doctoral),10-21-2024
134,"$10,000",NBCC Minority Fellowship Program for Mental Health Counselors (Master’s),10-21-2024
134,"$15,000",NBCC Minority Fellowship Program for Addictions Counselors,10-21-2024
136,"$1,000",Fund Your Future PAVE Student Aid Program,10-23-2024
136,"$1,000",CALG Scholarship Program,10-23-2024
136,"$2,000",WTS Minnesota Dan Meyers High School Scholarship,10-23-2024
139,Varies,The National Housing Endowment/Lee S. Evans Scholarship,10-26-2024
140,"$38,000",Hertz Foundation Graduate Fellowship,10-27-2024
140,$500,RMURISA GIS/Geospatial Scholarship,10-27-2024
141,"$3,500",WTS Beverley Swaim Staley Leadership Legacy Scholarship,10-28-2024
143,"$1,000",Anil G. Patel MD Memorial Scholarship,10-30-2024
143,"$1,500",CME Beef Industry Scholarship,10-30-2024
143,"$1,000",Albert & Ethel Herzstein Charitable Foundation Scholarship,10-30-2024
144,"$3,000",Doc Cohen Franchising Scholarship,10-31-2024
144,"$2,500",Fred DeLuca Foundation Scholarship,10-31-2024
144,"$8,000",Mildred C. Hanson SIOR Memorial Scholarship,10-31-2024
144,"$2,500",Stewart and Jane Bainum Fund Scholarship,10-31-2024
144,"$5,000",Bies Family Automotive SkillPointe Scholarship,10-31-2024
144,"$5,000",The Walt Disney UNCF Enhanced Scholars Program,10-31-2024
144,"$2,000",Brooks Instrument Undergraduate Engineering Scholarship,10-31-2024
144,"$2,000",Motorola Solutions Foundation Public Safety Explorer Scholarship,10-31-2024
144,"$5,000",Alma Exley Scholarship,10-31-2024
144,"$3,000",Pennsylvania Society of Public Accountants Scholarships,10-31-2024
144,"$15,000",Boeing Engineering Internship Program,10-31-2024
144,$500,SC Wildlife Federation Scholarships,10-31-2024
144,"$5,000",Workamajig Generative AI + Human Design Scholarship,10-31-2024
144,"$10,000",Steel Root Scholarship,10-31-2024
145,"$6,500",Nick & Helena Patti Foundation Scholarship,11-01-2024
145,Varies,Lindsay Sale-Tinney Award,11-01-2024
145,"$2,500",Linda Thompson Memorial Scholarship,11-01-2024
145,"$55,000",Stevens-Henager/CollegeAmerica Carl B. Barney Scholarship,11-01-2024
145,"$3,000",WIIT Scholarships,11-01-2024
145,"$30,000",Geoffrey Beene National Scholarship,11-01-2024
145,Varies,NAWT William Hapchuk Memorial Scholarship,11-01-2024
145,"$62,000",Smithsonian Institution Fellowship Program (SIFP),11-01-2024
145,Varies,Pulliam Journalism Fellowship,11-01-2024
145,"$15,000",AIA Site Preservation Grant,11-01-2024
145,"$15,000",Texas Music Educators Association High School Senior Scholarship,11-01-2024
145,Varies,Women Band Directors International College Scholarships,11-01-2024
145,"$10,000",AGC Undergraduate Scholarship,11-01-2024
145,"$7,500",AGC Graduate Scholarship,11-01-2024
145,"$3,000",DAAD German Studies Research Grant,11-01-2024
147,"$8,000",Virginia Museum of Fine Arts Visual Arts Fellowship,11-03-2024
147,$400,Sabin Art Scholarship Competition,11-03-2024
147,Varies,NRF Foundation Ray Greenly Scholarship,11-03-2024
147,"$7,500",Inspired by Design: PAVE Student Visionary Award,11-03-2024
147,Varies,National Defense Science & Engineering Graduate Fellowship,11-03-2024
147,"$5,000",Daniel K. Shipp Scholarship,11-03-2024
148,"$1,000",Future Technology Workforce Leaders & Visionaries (F12) Scholarship,11-04-2024
148,Varies,Dr. Lorraine G. Spranzo Memorial Scholarship,11-04-2024
150,Varies,NCWIT Award for Aspirations in Computing,11-06-2024
150,"$100,000",SLAS Graduate Education Fellowship Grant,11-06-2024
152,"$5,000",Roy G. Post Foundation Scholarship,11-08-2024
152,"$250,000",Regeneron Science Talent Search Scholarship,11-08-2024
152,"$5,000",CPCU Society NextGen Scholarship,11-08-2024
153,Varies,The Sharp Index Scholarship,11-09-2024
154,"$16,000",National GEM Consortium Fellowships,11-10-2024
154,"$50,000",Propel HBCU Week Student Impact Scholarship,11-10-2024
154,Varies,Women's Law and Public Policy Fellowship Program,11-10-2024
155,"$10,000",Anchor QEA Scholarship Program,11-11-2024
157,"$5,000",NALP Foundation Scholarships,11-13-2024
157,"$1,000",Hispanic Heritage Youth Awards,11-13-2024
157,"$5,000",Colgate-Palmolive Corporate Scholars Program,11-13-2024
157,"$1,000",Techs of Tomorrow Automotive Scholarship,11-13-2024
159,"$1,000",Future SPED Teacher Scholarship,11-15-2024
159,$500,Orangesoft Women in Technology Scholarship Program,11-15-2024
159,"$1,750",Sahara Hope Scholarship For Women Empowered To Change The World,11-15-2024
159,"$1,000",Scott Cooper Miami Scholarship,11-15-2024
159,"$4,000",10X Digital Marketing Scholarships,11-15-2024
159,"$1,000","ParkON Scholarship for Business, Marketing, or Hospitality Majors",11-15-2024
159,"$5,000",University of Massachusetts- Boston Krystle Campbell Scholarship,11-15-2024
159,"$1,000",Wild Fish For All Scholarship,11-15-2024
159,"$4,000",IISE Society for Health Systems Scholarship,11-15-2024
159,"$2,000",Hospitality Education Scholarship,11-15-2024
159,"$2,500",UCT Scholarship Program,11-15-2024
159,"$31,000",Charlotte W. Newcombe Dissertation Fellowships,11-15-2024
159,"$2,500",The James Alan Cox Foundation for Student Photojournalists,11-15-2024
159,$500,HaPI Measurement Scholarship,11-15-2024
159,"$10,000",Zonta International Amelia Earhart Fellowship,11-15-2024
159,"$2,500",ACES Education Fund Scholarship,11-15-2024
159,"$5,000",Armenian American Medical Society Scholarship,11-15-2024
159,Varies,ACES Bill Walsh Scholarship,11-15-2024
161,Varies,BIA Cares Scholarships,11-17-2024
161,"$3,500",W.I.S.E (Washington Women in STEM Excel) Scholarship,11-17-2024
162,"$1,500",IRHA Rural Dental & Social Work/Behavioral Scholarships,11-18-2024
163,"$2,000",MSA Law Enforcement Scholarship,11-19-2024
164,Varies,ACONM Transportation Industry Scholarship,11-20-2024
164,"$60,000",Modeling the Future Challenge,11-20-2024
