Days til due,Amount,Scholarship Title,Due Date
296,Varies,"Joseph R. Calder, Jr., MD Scholarship Fund",04-01-2025
296,"$1,500",Texas Society of Professional Engineers DFW Mid-Cities Chapter Scholarship,04-01-2025
296,Varies,NEEBC Scholarship Program,04-01-2025
296,"$5,000",ABA Academic Merit Scholarship,04-01-2025
296,"$5,000",ABA Diversity Scholarship,04-01-2025
296,"$5,000",ABA Member Scholarships,04-01-2025
296,Varies,AFWA Master’s Scholarship,04-01-2025
296,Varies,Kenneth and Marcia Johnson Scholarship,04-01-2025
296,"$30,000",Kress Foundation Interpretive Fellowships,04-01-2025
296,"$11,000",Montana Space Grant Consortium Graduate Fellowships,04-01-2025
296,"$5,000",Lockheed Martin Vocational Scholarship,04-01-2025
296,"$40,000",Lockheed Martin STEM Scholarship Program,04-01-2025
296,"$11,000",Kylie Murray Memorial Flight Training Scholarship,04-01-2025
296,"$2,500",Robert E. Thunen Memorial Scholarship,04-01-2025
296,"$2,000",GRCF Grand Rapids Combined Theatre Scholarship,04-01-2025
296,"$5,000",GM Women's Retail Network Drive to Succeed Scholarship,04-01-2025
296,"$2,000",Eula Mae Jett Scholarship,04-01-2025
296,Varies,LaFontaine Aquatic Entomology Scholarship,04-01-2025
296,"$2,500",David Armanasco Scholarship,04-01-2025
296,Varies,WRA Education Foundation Scholarship in Culinary & Hospitality,04-01-2025
296,"$2,500",RERF Third-Year Undergraduate Scholarship,04-01-2025
296,$500,CEJC/Bill Dull Scholarship,04-01-2025
296,Varies,Richland County Foundation Gregory VanScyoc Memorial Scholarship Fund,04-01-2025
296,"$5,000",Giana Foundation Scholarship,04-01-2025
296,"$1,000",Stephanie H. Greene Memorial Scholarship,04-01-2025
296,"$3,000",Anna N. Dosen Serbian Educational Fund,04-01-2025
296,Varies,RCF Helen Keatting Ott Scholarship Fund,04-01-2025
296,"$1,000",Belfry Theatre Scholarship,04-01-2025
296,Varies,Herman J. Neal Scholarship,04-01-2025
296,"$2,000",Oregon State Sheriff's Association Scholarship,04-01-2025
296,"$1,000",Officer Collin Rose Memorial Foundation Scholarship,04-01-2025
296,Varies,Lewis Cenker Scholarship,04-01-2025
296,"$3,000",Leo Bourassa Scholarship,04-01-2025
296,Varies,AFWA Undergraduate/5-Year Degree Scholarship,04-01-2025
296,"$1,500",LERMI Supports Law Enforcment,04-01-2025
296,Varies,AALL Degree Candidate Scholarships,04-01-2025
297,"$2,500",National Candy Technologists Scholarship,04-02-2025
298,"$1,000",Kinnett Scholarships for College/Further Education,04-03-2025
298,"$2,500",Girl Up Sports Fellowship,04-03-2025
298,"$30,000",Joseph S. Murphy Scholarship for Diversity in Labor,04-03-2025
298,"$1,000",David West Memorial Scholarship,04-03-2025
298,"$1,000",WMU Fisher Gerontology Dissertation Prize,04-03-2025
299,"$2,000",NESOWEA Scholarship,04-04-2025
299,"$5,000",ACF Davis-Kozoll Scholarship,04-04-2025
299,"$40,000",ACF Woodcock Family Education Scholarship,04-04-2025
299,"$2,500",RCI-IIBEC Foundation Lewis W. Newlan Scholarship,04-04-2025
299,$800,"ACF Barnes W. Rose, Jr. and Eva Rose Nickol Scholarship Program",04-04-2025
299,"$1,000",ACF Kiwanis Club of Albuquerque Scholarship Program,04-04-2025
299,"$5,000",RCI-IIBEC Foundation Robert W. Lyons Award,04-04-2025
300,Varies,West Coast Equine Foundation Scholarship,04-05-2025
300,"$10,000",CAPS Medical Student Scholarship,04-05-2025
300,"$8,000",Sacramento Press Club Journalism Scholarships,04-05-2025
300,"$1,400",Lucile E. Wright Scholarship,04-05-2025
300,"$1,000",Valley Press Club Scholarship,04-05-2025
300,"$10,000",NYIPLEF Diversity Scholarships,04-05-2025
300,"$2,500",Benjamin D. and Miriam Pessin Education Assistance Fund,04-05-2025
300,"$10,000",ESET Women in Cybersecurity Scholarship,04-05-2025
300,"$5,000",Herbert W. Nickens Medical Student Scholarships,04-05-2025
300,"$7,500",Carl Tapp Technician Scholarship,04-05-2025
300,"$1,000",Kazickas Family Foundation Art Scholarships,04-05-2025
301,"$10,000",Arborjet Taking Root Scholarship,04-06-2025
301,"$2,500",Centex Homes/NHE Build Your Future Scholarship Program,04-06-2025
302,"$10,000",The Johnson & Johnson Access-Ability Lime Scholarship,04-07-2025
302,"$1,000",Post-Graduate Scholarship (Aeronautics),04-07-2025
302,"$40,000",Underwood-Smith Teaching Scholars Program,04-07-2025
302,"$1,000",Antioch Garden Club Community Scholarship,04-07-2025
302,"$2,500",International Titanium Association Scholarship Program,04-07-2025
302,"$1,000",Post-Graduate Scholarship (Cardiology),04-07-2025
302,"$10,000",BMO Capital Markets Lime Connect Equity Through Education Scholarship,04-07-2025
303,"$10,000","International Scientific Fellowships for Master, PhD & Medical Students",04-08-2025
303,"$100,000",Samvid Scholars,04-08-2025
303,"$1,000",Delaware School Nutrition Association Scholarship,04-08-2025
303,"$3,000",Dr. Benjamin C Blackburn Scholarship,04-08-2025
303,$500,Home Builders Care of Fargo-Moorhead Foundation Scholarships,04-08-2025
304,"$5,000",Matt Heuertz Scholarship Program,04-09-2025
305,"$10,000",The Lewis Scholarship,04-10-2025
305,"$10,000",Duthoy Scholarship Program,04-10-2025
305,"$5,000",Dream In Color Grant,04-10-2025
306,"$2,500",Nebraskaland Scholarship,04-11-2025
307,"$5,000",7X24 Exchange Rocky Mountain Chapter Scholarship,04-12-2025
307,"$1,000",VFRW Kendall Rhodes Scholarship,04-12-2025
307,"$29,000",UTM Noyce Scholars Program,04-12-2025
307,"$2,500",SAME Seattle Post & PSE&SSF Scholarships,04-12-2025
307,"$10,000",Washington Wine Industry Foundation Scholarship,04-12-2025
307,"$5,000",John R. Pandolfi Scholarships,04-12-2025
307,"$5,000",Bernard Harris Scholarship,04-12-2025
307,"$2,500",Jack G. Shaheen Mass Communications Scholarship Award,04-12-2025
307,"$2,500",MBA Student Broadcaster Scholarship,04-12-2025
307,"$2,500",Beulah Frey Environmental Scholarship,04-12-2025
307,Varies,Steigleder Family Scholarship,04-12-2025
307,"$5,000",Adena Health Foundation Scholarships,04-12-2025
307,"$2,000",SWE Golden Gate High School Scholarship Program,04-12-2025
307,Varies,The Tim DeWitt HARVEST Education Foundation Scholarship,04-12-2025
307,"$1,000",VFRW Political Studies Scholarship,04-12-2025
307,Varies,G.B. Mann Scholarship,04-12-2025
307,"$3,000",Suncoast Music Scholarship,04-12-2025
307,"$14,000",HITEC Foundation Scholarship,04-12-2025
307,Varies,Plan New Hampshire Scholarship & Fellowship,04-12-2025
309,"$7,500",Organization of Latino Actuaries Scholarship Program,04-14-2025
309,"$1,500",Letitia B. Carter Scholarship,04-14-2025
309,"$2,000",Washington CPA Foundation Associate Accounting Scholarships,04-14-2025
309,"$2,000",Washington CPA Foundation Associate Accounting Scholarship,04-14-2025
309,"$10,000",Minority Corporate Counsel Association LMJ Scholarship Program,04-14-2025
309,"$3,500",Dream.Org Tech Scholarship Fund,04-14-2025
309,"$5,000",Martha Meade Memorial Scholarship,04-14-2025
309,"$10,000",CNCDA Scholarship Program,04-14-2025
309,"$1,000",Norma Gray College Scholarship for the Visual Arts,04-14-2025
309,"$5,000",The Dennis and Shirley Feldman Fellowship,04-14-2025
309,"$4,000",CBF At-Large Leadership Scholarship,04-14-2025
309,"$3,500",CMAA Mid-Atlantic Chapter Scholarship,04-14-2025
309,"$1,000",Hopson-Laurent Scholarship,04-14-2025
309,"$5,000",ULINE Scholarship,04-14-2025
310,"$1,000",MOASPA-STL Educator's Scholarship,04-15-2025
310,"$1,500","Stephen L. Teller & Richard Hotson TV, Cinema, and Theater Scholarship",04-15-2025
310,"$5,000",Matt Fong Asian Americans in Public Finance Scholarship,04-15-2025
310,"$1,000",June Gill Nursing Scholarship,04-15-2025
310,"$1,500",OAN Mt. Hood Chapter Award I & II,04-15-2025
310,"$3,000",Laurels Fund Scholarship,04-15-2025
310,"$1,000",OAN Larry Fitzgerald Memorial Scholarship,04-15-2025
310,"$1,500",Sage DE&I Scholarship Award,04-15-2025
310,"$2,000",Asparagus Club Scholarship,04-15-2025
310,"$2,500",Utility Arborist Nelsen Money Scholarship,04-15-2025
310,"$1,500",The Stella Cretella Scholarship,04-15-2025
310,"$1,000",John Cowan Memorial Scholarship,04-15-2025
310,"$2,000",OAN Emerald Empire Chapter Award,04-15-2025
310,Varies,ESA Foundation Computer and Video Game Arts Scholarship,04-15-2025
310,"$1,000",Judith A. Sanders Memorial Scholarship,04-15-2025
310,"$3,000",ESA Foundation Scholarship Program for Minority Students,04-15-2025
310,"$3,000",EnerGIS Scholarship,04-15-2025
310,"$1,000",Kenneth & Margaret Deane Scholarship,04-15-2025
310,"$1,000",Kentucky Student Technology Leadership Program (STLP) Scholarship,04-15-2025
310,"$1,000",RTF Cyber Security Scholarship,04-15-2025
310,"$5,000",AABE NJ Chapter Scholarship,04-15-2025
310,"$10,000",Northwest Osteopathic Medical Foundation Scholarship Program,04-15-2025
310,"$2,500",WGA Mary Macey Scholarship,04-15-2025
310,"$1,500",Barry Kasdan Scholarship,04-15-2025
310,"$1,500","Teller & Hotson TV , Cinema, and Theater Scholarship",04-15-2025
310,"$1,500",NDS Merton Sowerby Junior Merit Scholarship,04-15-2025
310,"$2,000",OAN Retail Chapter Awards,04-15-2025
310,$400,Brent Strohmeyer Memorial Foundation Scholarship,04-15-2025
310,"$2,000",OAN Willamette Chapter Award,04-15-2025
310,"$6,000",Bart Pitman Music Scholarship,04-15-2025
310,"$1,000",Mary and Lucian Cassetta Memorial Music Scholarship,04-15-2025
310,"$2,500",Oregon Music Hall of Fame Scholarship,04-15-2025
310,"$3,000",Emily M. Hewitt & Stephen Stocking Memorial Scholarships,04-15-2025
310,"$2,000",Charles Shelton Veterinarian Medicine/Technology Scholarship,04-15-2025
310,"$5,000",Colorado Hospitality Scholarship Program,04-15-2025
310,"$10,000",March of Dimes Graduate Nursing Scholarships,04-15-2025
310,Varies,NADONA LTC Stephanie Carroll Scholarship,04-15-2025
310,"$3,000",NCJWLA Inger Lawrence - M.R. Bauer Foundation Nursing Studies Scholarship,04-15-2025
310,Varies,Virginia Department of Health Nursing Scholarships,04-15-2025
310,"$5,000",The Lacek Group BIPOC Scholarship,04-15-2025
310,"$1,000",Edna R. Anthony Scholarship,04-15-2025
310,"$1,000",Outdoors Communicators of Kansas Harper Memorial Scholarship,04-15-2025
310,Varies,New York Financial Writers' Association Scholarship,04-15-2025
310,"$1,000",The Maureen D. Keller Undergraduate Scholarship,04-15-2025
310,"$5,000",NCJWLA Jeffrey A. Tidus Scholarship For Healthcare Professionals,04-15-2025
310,"$25,000",Gloria Barron Wilderness Society Scholarship,04-15-2025
310,"$1,000","Hagan Business Machines of Meadville, Inc. Scholarship",04-15-2025
310,"$2,500",NWPA NTMA Scholarships,04-15-2025
310,"$3,500",Seabee Memorial Scholarship Association Scholarships,04-15-2025
310,"$3,000",NGA Foundation Scholarships,04-15-2025
310,"$8,000",Nellie Martin Carman Scholarship,04-15-2025
310,"$1,500",NDS Mike Lancaster Sophomore Merit Scholarship,04-15-2025
310,"$10,000",GeoKids LINKS Graduate Fellowship in Biology,04-15-2025
310,"$2,000",Sagebrush Circuit - Lew & Jo Eklund Educational Scholarship,04-15-2025
310,"$20,000",American Association of Blacks in Energy Scholarship,04-15-2025
310,"$3,500",Aaron Thomas Memorial Scholarship,04-15-2025
310,"$8,000",KCAF Scholarships,04-15-2025
310,"$1,000",NESS NextGen Scholarship,04-15-2025
310,"$2,000",NDS Student Recognition Award for Seniors,04-15-2025
310,"$1,000",NDS McCullough Scholarship,04-15-2025
310,"$1,000",NDS Maurice E. Core Scholarship,04-15-2025
310,"$10,000",Rear Admiral John D. Hayes Pre-Doctoral Fellowship,04-15-2025
310,"$1,500",NDS Klussendorf/McKown Scholarship,04-15-2025
310,"$3,000",NDS Kildee Graduate School Scholarships,04-15-2025
310,"$1,000",OAN Sid and Cindy Miles Nursery Award,04-15-2025
310,"$1,000",Womanspace High School Senior Fine Arts Scholarship,04-15-2025
310,"$1,500",Kris Paper Legacy Scholarship For Women In Technology,04-15-2025
310,"$2,500",Marina Landscape Scholarship,04-15-2025
310,"$1,000",Peppy Moldovan Memorial Award,04-15-2025
310,"$1,000",NDS Iager Scholarship,04-15-2025
310,Varies,The HCBF Scholarship,04-15-2025
310,Varies,Captain Jeff Kuss Aviation Scholarship,04-15-2025
310,"$1,000",Abbie Sargent Memorial Scholarship,04-15-2025
310,"$1,000",CLIC Scholarship,04-15-2025
310,"$1,500",NDS DMI Milk Marketing & Dairy Products Scholarship,04-15-2025
310,"$5,000",Folsom Garden Club Scholarship,04-15-2025
310,"$1,000",DeNise Scholarship Fund,04-15-2025
310,"$3,000",Ashtabula County Agricultural Scholarship Fund,04-15-2025
310,"$5,000",Samuel Eliot Morison Scholarship,04-15-2025
310,"$2,500",American Sports Builders Foundation Scholarship,04-15-2025
310,Varies,Tennessee Teaching Scholars Program,04-15-2025
310,"$3,000",NCJWLA The Sherman & Frances L. Teller Teaching Credential Scholarship,04-15-2025
310,"$1,000",Oregon PTA Teacher Education Scholarship,04-15-2025
310,"$5,000",Tennessee Minority Teaching Fellows Program,04-15-2025
310,"$5,000",Legal Opportunity Scholarship Fund,04-15-2025
310,"$1,500",NDS Dairy Shrine/DMI Education & Communication Scholarship,04-15-2025
310,"$2,000",Illinois Engineering Initiative Scholarship,04-15-2025
310,"$1,000",Zach Wardrip Memorial Scholarship,04-15-2025
310,"$2,000",The Fulgham/Fulghum National Foundation Scholarship,04-15-2025
310,"$2,000",Wayfinder Society Student Mini-Grant,04-15-2025
310,"$3,000",Oregon Association of Nurseries Scholarship Program,04-15-2025
310,"$1,000",NCJWLA Elizabeth Carter Scholarship in Archaeology,04-15-2025
310,"$1,000",Ad Club of Western Massachusetts Scholarship,04-15-2025
310,"$2,500",Vice Admiral Edwin B. Hooper Post-Doctoral Research Grant,04-15-2025
310,"$3,000",BHW Scholarship,04-15-2025
310,"$22,904",Butkus-Sylvester Family Scholarship,04-15-2025
310,"$10,000",U.S. Stockholm Junior Water Prize,04-15-2025
310,"$2,000",NSTA Local Impact Scholarship,04-15-2025
311,"$25,000",CREW Chicago Scholarship,04-16-2025
311,"$10,000",Whitney French Design Scholarship,04-16-2025
312,Varies,Mike Rowe Work Ethic Scholarship,04-17-2025
312,"$5,000",Ohio EPA Scholarship,04-17-2025
312,"$20,000",The Mckenzie Family Scholarship,04-17-2025
312,"$2,000",SAJA Scholarship Program,04-17-2025
312,"$1,000",NINA Journalism Scholarship,04-17-2025
312,"$10,000",The Eric Pardall Memorial Scholrahip,04-17-2025
313,"$2,000",Believe in Ohio Statewide STEM Scholarship,04-18-2025
313,"$1,000",Paul S. Honda Scholarships,04-18-2025
314,"$5,000",IBTTA Foundation Scholarship Program,04-19-2025
314,"$7,500",Association for Women in Architecture Foundation Scholarship,04-19-2025
314,"$3,000",AIA Northeast Illinois Scholarship,04-19-2025
314,Varies,AAF-Greater Evansville Scholarship,04-19-2025
314,"$1,200",BCC Foundation Donna Johnson Memorial Scholarship,04-19-2025
314,"$2,500",The Mary Elizabeth Dodson Conrad Scholarship,04-19-2025
314,"$1,000",The Pearl Mae Foundation Scholarship for Healthcare and First Responders,04-19-2025
314,"$3,000",Texas Women in Public Finance Scholarship,04-19-2025
314,"$1,500",Tampa Bay OWIT Scholarships,04-19-2025
315,Varies,Central Coast Greenhouse Growers Association Scholarship,04-20-2025
315,"$10,000",Edwards Lifesciences Foundation Scholarship,04-20-2025
315,"$1,000",Wisconsin Women in Lodging & HSMAI-WI,04-20-2025
316,"$1,500",Michigan Nutrition and Dietetics Institute (MNDI) Scholarships,04-21-2025
316,"$5,000",AIA Silicon Valley William R. Hawley Scholarship,04-21-2025
316,"$5,000",AIA Silicon Valley Ehrlich Rominger Scholarship,04-21-2025
316,"$10,000",Google Lime Scholarship,04-21-2025
316,"$5,000",AIGA Worldstudio Scholarships,04-21-2025
317,"$3,000",New Mexico Engineering Foundation Scholarships,04-22-2025
317,"$5,000",CRA All-Access Scholarship,04-22-2025
317,"$4,000",ASID Legacy Scholarship for Undergraduates,04-22-2025
317,"$4,500",LaSPACE LURA Program,04-22-2025
317,"$5,000",ASID Joel Polsky Prize,04-22-2025
317,"$12,000",David Barrett Memorial Scholarship,04-22-2025
317,"$2,500",COMTO North Texas Scholarship,04-22-2025
317,"$4,000",ASID Legacy Scholarship for Graduate Students,04-22-2025
318,"$10,000",Google SVA Scholarship for Student Veterans,04-23-2025
318,$500,The Hyacinth Scarlett Music Memorial Scholarship,04-23-2025
320,"$6,000",NATAS Southeast Foundation Scholarship,04-25-2025
320,"$7,000",Joseph Shinoda Memorial Scholarship,04-25-2025
320,"$1,500",CCPA Native American Scholarship,04-25-2025
320,Varies,NHSC Scholarship Program,04-25-2025
321,"$5,000",Builders League of South Jersey Scholarship Foundation,04-26-2025
321,"$5,000",Davis Memorial Foundation Scholarship,04-26-2025
321,"$2,500",Linda Craig Memorial Scholarship,04-26-2025
321,"$5,000",Calculated Genius STEMinist Scholarship,04-26-2025
321,"$1,000",NCITD International Trade Scholarship Program,04-26-2025
321,"$1,500",SENEDIA STEM Scholarship,04-26-2025
321,"$3,000",COMTO Philadelphia Chapter Scholarship,04-26-2025
321,"$5,000",NPFDA Scholarship Foundation,04-26-2025
321,"$2,000",AIANTA Tourism & Hospitality Scholarship,04-26-2025
321,"$1,000",Hsiao Memorial Economics Scholarship,04-26-2025
321,"$2,000",The Agnes Cooke Scholarship,04-26-2025
321,"$2,500",Marylinn Munson & Bio Nebraska STEM Scholarship,04-26-2025
321,"$1,000",NSPE-NH State Scholarship Program,04-26-2025
321,"$2,500",CTASLA Scholarships,04-26-2025
321,"$5,000",WHFF Plein Environmental Scholarship,04-26-2025
321,"$1,000",Robert and Joanne Koch Scholarship for Architecture,04-26-2025
321,"$1,000",BLK Men in Tech Scholars Program,04-26-2025
321,"$2,000",VABA Aviation Scholarship,04-26-2025
322,"$5,000",Axalta Bright Futures Scholarship Program,04-27-2025
322,"$60,000",CBC Ally Financial Law Scholars Program,04-27-2025
322,"$2,000",Achievers in Technology Program,04-27-2025
322,"$10,000",CBC Ally Financial Public Policy Scholars Program,04-27-2025
323,"$1,000",SVCF James A. McCavitt and Annie LePors McCavitt Scholarship,04-28-2025
323,"$2,500",Connecticut SPJ Foundation College Scholarship,04-28-2025
323,"$1,200",McLean Family Scholarship,04-28-2025
323,"$1,500",Latino Social Work Coalition Scholarship,04-28-2025
323,"$2,000",Seattle Co-Arts Scholarship,04-28-2025
324,"$1,000",PEGTV Courcelle Scholarship,04-29-2025
324,"$2,000","Clem Judd, Jr. Memorial Scholarship",04-29-2025
324,"$2,500",ANS Savannah River Richard “Dick” Benjamin Memorial Scholarship,04-29-2025
324,"$2,000","R.W. ""Bob"" Holden Scholarship",04-29-2025
324,"$2,200",Lucile Murray Durkin Scholarship,04-29-2025
324,"$5,000",Oceantic Network's Rising Star Student Scholarship,04-29-2025
325,"$10,000","E. Anne Spitzer, MD Memorial Scholarship",04-30-2025
325,"$3,000",Chris Andersen WomenLead Scholarship,04-30-2025
325,"$10,000",NBCC Garden State Master's Counseling Initiative Fellowship,04-30-2025
325,Varies,NLBHA Josie Torralba Romero Scholarship Fund,04-30-2025
325,"$5,000",AMA Houston Penny Todd Scholarship,04-30-2025
325,"$5,000",Cuidado Casero Foundation Nursing Scholarship,04-30-2025
325,"$1,000",GMiS California Health Sciences Scholarships,04-30-2025
325,"$7,500",Andrew Budraitis Foundation Lehigh Valley Scholarships,04-30-2025
325,"$3,000",Donald Handeland Scholarship,04-30-2025
325,"$1,000",Chester Burger Scholarship for Excellence in Public Relations,04-30-2025
325,"$2,000",Public Relations Scholarship,04-30-2025
325,"$3,000",John D. Graham Scholarship,04-30-2025
325,"$2,000",May C. Randazzo Memorial Scholarship,04-30-2025
325,"$1,000",Ofield Dukes Multicultural Student Award,04-30-2025
325,"$1,500",PRSA Diversity Multicultural Scholarship,04-30-2025
325,Varies,FWEN Scholarships,04-30-2025
325,"$5,000",Massport Memorial & Diversity STEM Scholarships,04-30-2025
325,"$1,000",oxyGEN with AT&T National Scholarship,04-30-2025
325,"$1,250",SILA Post Secondary College Scholarship,04-30-2025
325,"$1,000",Waukegan Park District Scholarship,04-30-2025
325,"$2,000",Axia Public Relations Scholarship,04-30-2025
325,"$3,000",PRSA Houston Scholarships,04-30-2025
325,"$1,000",Brown MAE Foundation Healthcare Scholarship,04-30-2025
325,"$5,000",GMiS STEM Scholarship,04-30-2025
325,"$5,000",SWR Foundation Scholarship,04-30-2025
325,"$5,000",David C. Lizárraga Fellowship,04-30-2025
325,"$80,000",Elevate-A-Life Scholarship,04-30-2025
325,"$1,000",Regina C. Williams Memorial Scholarship,04-30-2025
325,"$1,000",Jim Dempsey Foundation Scholarship,04-30-2025
325,"$1,000",Brown MAE Foundation Education Scholarship,04-30-2025
325,"$1,000",ASCE New Hampshire High School Scholarship,04-30-2025
325,"$10,000",AISES Burlington Northern Santa Fe (BNSF) Foundation Scholarship,04-30-2025
325,"$4,000",Regional Airline Association Scholarship,04-30-2025
325,"$10,000",The American Indian Science and Engineering Society Scholarships,04-30-2025
325,Varies,PLS Foundation Scholarships,04-30-2025
325,"$2,500",Southeast Desalting Association Scholarship,04-30-2025
325,"$2,500",ConvenientMD Student Scholarships,04-30-2025
325,"$2,000",Allina Health EMPOWER Scholarships,04-30-2025
325,"$1,000",WCU Sustainability and Badge of Honor Scholarships,04-30-2025
325,"$1,000",RPW Political Studies Scholarship,04-30-2025
325,"$2,500","Delaware Solid Waste Authority John P. ""Pat"" Healy Scholarship",04-30-2025
325,"$12,000",Allied Health Scholarship,04-30-2025
325,Varies,Society of Professional Journalists Buffalo Chapter Scholarship,04-30-2025
325,"$3,000",South Carolina Farm Bureau Foundation Scholarships,04-30-2025
325,Varies,Robert J. Meyer Organic Farming Scholarship,04-30-2025
325,"$1,500",NTHA Forest Resources Scholarship,04-30-2025
325,"$2,000",Norristown Garden Club Scholarship,04-30-2025
325,"$2,000",James P. Brannan IT Scholarship,04-30-2025
325,"$2,000",IWSH Scholarship Essay Contest,04-30-2025
325,"$1,000",Florida Green Building Coalition Scholarship,04-30-2025
325,Varies,EPOC Environmental Scholarship Fund,04-30-2025
325,"$7,500",Certified Angus Beef Colvin Scholarship Fund,04-30-2025
325,"$2,000",AISES A.T. Anderson Memorial Scholarship,04-30-2025
325,"$1,000",Support for Maine Students Scholarship,04-30-2025
325,Varies,The Häring Scholarship,04-30-2025
325,Varies,APA Judith McManus Price Scholarship,04-30-2025
325,Varies,Association of Women Contractors Scholarship,04-30-2025
325,"$4,000",Oklahoma Christian University Bible Scholarship,04-30-2025
325,"$1,000",The Restoration of Sight & Health Scholarship,04-30-2025
325,Varies,The Royal Brougham Foundation Scholarship,04-30-2025
325,"$2,500",Blue Collar Brain Trade School Scholarship,04-30-2025
325,"$10,000",IFMA Foundation Scholarship Program,04-30-2025
325,"$5,000",CMAA Undergraduate & Graduate Scholarship,04-30-2025
325,"$4,000",First Presbyterian Church of Shreveport Scholarship,04-30-2025
325,"$2,000",APA Charles Abrams Scholarship,04-30-2025
325,"$2,000",Friends of Moraine Hills State Park Scholarship in Environmental Studies,04-30-2025
325,"$10,000",Jerry Northern Scholarship in Pediatric Audiology,04-30-2025
325,"$5,000",Empowering Students Scholarship,04-30-2025
325,"$2,000",Continued Achievement Scholarship,04-30-2025
325,"$5,000",National Aviation Explorer Scholarships,04-30-2025
325,"$5,000",WCADC Visual Arts Scholarship,04-30-2025
326,"$15,000",Fellows Foundation Scholarship,05-01-2025
326,"$20,000",Print and Graphics Scholarship Foundation,05-01-2025
326,"$1,000",Editor World First-Generation Student Scholarship,05-01-2025
326,"$1,500",NVFEH Scholarship for Medical Students,05-01-2025
326,"$2,000",WiNUP Fellowships,05-01-2025
326,"$2,500",PMI Phoenix Chapter Scholarship,05-01-2025
326,"$5,000",Dewar Family Scholarship,05-01-2025
326,"$1,500",Oracle Women In Leadership Scholarship,05-01-2025
326,"$40,000",William Orr Dingwall Foundation Dissertation Fellowship,05-01-2025
326,"$20,000",American College of Radiology STEM Scholarship,05-01-2025
326,"$1,000",STEM for Every Child Scholarship,05-01-2025
326,"$2,500",STEM Teachers for America's Future: Graduate Scholarships,05-01-2025
326,"$2,500",AFCEA War Veterans Scholarships: Undergraduate Only,05-01-2025
326,"$3,000",AFCEA ROTC Scholarships,05-01-2025
326,"$64,000",Tennessee Tech Undergraduate Scholarships,05-01-2025
326,"$5,000",SWANA Scholarships,05-01-2025
326,"$5,000",STEM Major Scholarships for Undergraduate Students,05-01-2025
326,"$5,000",Seed Companies Scholarship,05-01-2025
326,"$3,000",Ralph W. Shrader Graduate Diversity Scholarship,05-01-2025
326,"$3,000",Dawn Steward Memorial Scholarship for Large Animal Vet Students,05-01-2025
326,"$2,500",EESF Master's Degree Scholarships,05-01-2025
326,"$5,000",Austin Community College Career Scholars,05-01-2025
326,"$6,000",AMBUCS Scholars Scholarships for Therapists,05-01-2025
326,Varies,Angus Foundation Undergraduate Student Scholarship,05-01-2025
326,"$1,000",Bradford-Sullivan Forest Landowners' Association Scholarship,05-01-2025
326,"$5,000",Calflowers Scholarship,05-01-2025
326,"$5,000",Jacob And Rita Van Namen Marketing Scholarship,05-01-2025
326,"$1,000",Greater Than Gatsby Annual Scholarship,05-01-2025
326,"$1,500",Colonel Kathleen Swacina Scholarship,05-01-2025
326,"$1,000",Farm and Ranch Depot Scholarship Program,05-01-2025
326,"$2,000",PMI Robert J. Yourzak Scholarship Award,05-01-2025
326,"$5,000",James Bridenbaugh Memorial Scholarship,05-01-2025
326,Varies,Les Dames d'Escoffier Colorado Chapter Scholarship,05-01-2025
326,$500,Murphy Memorial Scholarship,05-01-2025
326,"$1,000",NJACD Memorial Conservation Scholarship,05-01-2025
326,"$5,000",Ferriss Horticulture Scholarship,05-01-2025
326,$500,Associated Subcontractors of MA Trade School Scholarship,05-01-2025
326,"$5,000",Edward Tuinier Memorial Scholarship,05-01-2025
326,"$1,000",Michigan Nurses Foundation Scholarships,05-01-2025
326,"$7,500",PMI Dr. Harold Kerzner Scholarship,05-01-2025
326,"$5,000",American Florists' Exchange Scholarship,05-01-2025
326,"$5,000",Ball Horticultural Company Scholarship,05-01-2025
326,"$2,000",Discover Manufacturing Scholarship,05-01-2025
326,"$5,000",Carlson-Johnson Scholarship for Nontraditional Students,05-01-2025
