Days til due,Amount,Scholarship Title,Due Date
165,"$5,000",Helene M. Overly Memorial Graduate Scholarship,11-21-2024
165,"$5,000",WTS Leadership Legacy Scholarship for Graduates,11-21-2024
165,"$3,000",WTS Baltimore Undergraduate Scholarship,11-21-2024
168,"$10,000",Aquarium of the Pacific African American Scholar Program,11-24-2024
169,"$5,000",UNCF K-12 Education Fellowship,11-25-2024
169,"$2,500",Zipit Future of Connectivity Essay Scholarship,11-25-2024
171,"$7,000",WTS Portland Scholarships,11-27-2024
171,"$1,000",Agriculture Education Foundation Scholarship,11-27-2024
171,"$1,000",Muir Way Scholarship,11-27-2024
171,"$1,000",The Weber Shandwick Scholarship,11-27-2024
173,"$2,500",Dan L. Meisinger Sr. Memorial Learn to Fly Scholarship,11-29-2024
174,"$1,000",Brent Willis Scholarship,11-30-2024
174,"$1,500",Superior Seating Scholarship,11-30-2024
174,"$3,000",The Dental Accounting Group Business Leadership Scholarship,11-30-2024
174,"$1,000",All-American Pest Control STEAM Trailblazer Scholarship,11-30-2024
174,"$10,000",The John Galt Scholarship for Future Supply Chain Leaders,11-30-2024
174,"$6,000","SmithGroup Equity, Diversity and Inclusion Scholarship Program",11-30-2024
174,"$50,000",Posen Foundation Program,11-30-2024
174,"$3,000",Peter K. New Award,11-30-2024
174,"$2,000",Pest Management Foundation Scholarship,11-30-2024
174,"$1,000",NJPMA Pest Professional Stewardship Scholarship,11-30-2024
174,"$5,000",The Explorers Club Student Grants,11-30-2024
174,"$3,000",Women in Tech Scholarship,11-30-2024
174,"$30,000",Kress Foundation History of Art Institutional Fellowships,11-30-2024
174,"$5,000",Kaiser Permanente Northern California Medical Student Scholarship,11-30-2024
174,"$5,000",Susan Lawrence Soldier For Life Scholarship,11-30-2024
174,"$1,500",Surety Bond Authority Scholarship,11-30-2024
174,"$2,000",Emery Reddy Legal Studies Scholarship,11-30-2024
175,"$45,000",AQHA Margaret A. Haines Telephony Scholarship,12-01-2024
175,"$1,500",American Indian Nurse Scholarship Awards,12-01-2024
175,"$2,500",WTS Transportation YOU High School Scholarship,12-01-2024
175,"$1,500",Excedr Scholarship for STEM Graduate Students,12-01-2024
175,"$20,000",University of Illinois Kate Neal Kinley Memorial Fellowship,12-01-2024
175,"$32,000",AQHA Journalism or Communications Scholarship,12-01-2024
175,"$12,000",Barbara Lotze Scholarship for Future Physics Teachers,12-01-2024
175,"$30,000",MMUF Dissertation Grants,12-01-2024
175,"$3,000",Norman S. Baldwin Fishery Science Scholarship,12-01-2024
175,"$49,500",The SMART Scholarship-for-Service Program,12-01-2024
175,"$4,000",Overseas Press Club Foundation Awards,12-01-2024
175,"$5,000",Ray Stoesser Memorial Scholarship,12-01-2024
175,"$1,000",Charlie Parnell Memorial Scholarship,12-01-2024
176,"$2,500",William Lowell Putnam Competition,12-02-2024
177,"$5,000",Sharon D. Banks Memorial Undergraduate Scholarship,12-03-2024
178,"$24,000",South Carolina Teaching Fellows,12-04-2024
178,Varies,Angelo Tagliacozzo Memorial Geological Scholarship,12-04-2024
178,"$15,000",National Space Club and Foundation Keynote Scholars Program,12-04-2024
179,"$2,500",Larry Morris Memorial Scholarship,12-05-2024
182,"$1,000",Nurse Practitioner Healthcare Foundation Scholarships,12-08-2024
182,"$3,000",ASA Northeast Scholarship,12-08-2024
182,"$2,500",WTS Indianapolis Community College/ Technical/ Trade School Scholarship,12-08-2024
182,"$3,500",WTS Indianapolis Chapter Helene M. Overly Memorial Scholarship,12-08-2024
182,"$2,500",WTS Indianapolis Chapter Sharon D. Banks Memorial Undergraduate Scholarship,12-08-2024
182,"$5,000",HearingLife Scholarship for Audiology Students,12-08-2024
182,"$1,500",NJCPA High School Senior Scholarship,12-08-2024
183,"$3,000",Annual SLMP Student Scholarship,12-09-2024
184,"$1,000",NAACP Environmental Scholarships,12-10-2024
184,"$40,000",NATAS John Cannon Memorial Scholarship,12-10-2024
187,"$1,000","1,000 Dreams Paliwal Club of 100 Scholarship",12-13-2024
187,"$160,000",Cards Against Humanity Science Ambassador Scholarship,12-13-2024
188,"$5,000",Scientist.com STEM Research NIL Award,12-14-2024
189,"$40,000",Amazon Future Engineer Scholarship,12-15-2024
189,"$15,000",Scarlett Family Foundation Scholarship,12-15-2024
189,"$1,000",Leah J. Dickstein Medical Student Award,12-15-2024
189,"$1,000",Medical Scrubs Collection Scholarship,12-15-2024
189,"$1,500",BOWEN Web Design Scholarship,12-15-2024
189,"$50,528",University of Louisville McConnell Scholars Program,12-15-2024
189,"$48,750",University of Rochester Frederick Douglass Scholarship,12-15-2024
189,"$44,000",Center for Communicable Disease Dynamics at Harvard School of Public Health,12-15-2024
189,"$10,000",Adam Ferrari Health Science Scholarship,12-15-2024
189,"$1,000",Allied Van Lines Scholarship,12-15-2024
189,"$1,000",AI Innovators Undergraduate Scholarship,12-15-2024
189,"$1,500",ZEISS Metrology Scholarship Contest,12-15-2024
189,"$2,500",Interstellar Research Group Tim Bolgeo Memorial Scholarship,12-15-2024
189,"$2,500",Interstellar Research Group Doctoral Graduate College Scholarship Program,12-15-2024
189,"$2,500",Interstellar Research Group Master’s Graduate College Scholarship Program,12-15-2024
193,"$5,000",Woodard and Curran Scholarship,12-19-2024
193,"$5,000",Gannett Fleming Scholarship,12-19-2024
193,"$5,000",Dave Caldwell Scholarship,12-19-2024
193,"$30,000",Abel Wolman Fellowship,12-19-2024
193,"$30,000",American Water Works Association Scholarships,12-19-2024
193,"$5,000",Veolia Water Technologies & Solutions Vernon D. Lucy III Scholarship,12-19-2024
193,"$5,000",Raftelis Leadership Scholarship,12-19-2024
193,"$5,000",Hazen and Sawyer Scholarship,12-19-2024
193,"$10,000",AWWA Stantec Scholarship,12-19-2024
193,"$10,000",AWWA Jacobs Holly A. Cornell Scholarship,12-19-2024
193,"$5,000",AWWA AECOM Scholarship,12-19-2024
193,"$5,000",Mueller Continuing Education Scholarship,12-19-2024
193,"$5,000",Neptune Technology Group Scholarship,12-19-2024
193,"$10,000",AWWA HDR One Water Industry Scholarship,12-19-2024
193,"$10,000",Carollo Engineers Bryant L. Bench Scholarship,12-19-2024
194,Varies,Dr. Nancy Foster Scholarship,12-20-2024
195,"$3,000",AWWA Dr. Philip C. Singer Scholarship,12-21-2024
195,$500,NSTA Angela Award,12-21-2024
195,"$7,000",AWWA Larson Aquatic Research Support Scholarships,12-21-2024
195,"$5,000","Charles ""Chick"" Roberts Scholarship",12-21-2024
196,"$30,000",Saul Kagan Fellowship in Advanced Shoah Studies,12-22-2024
201,"$1,000",Pioneers of Flight Scholarship,12-27-2024
203,"$2,500",AREMA Undergraduate and Graduate Scholarships,12-29-2024
203,"$1,000",Union Pacific William E. Wimmer Scholarship,12-29-2024
204,"$10,000",Frank L. Greathouse Government Accounting Scholarship,12-30-2024
204,"$25,000",Goldberg-Miller Public Finance Scholarship,12-30-2024
204,"$10,000",Government Finance Professional Development Scholarship,12-30-2024
204,"$15,000",Jeffrey L. Esser Career Development Scholarship,12-30-2024
204,"$10,000",Minorities In Government Finance Scholarship,12-30-2024
204,"$5,000",Future Attorneys of America Merit Scholarship,12-30-2024
204,"$1,000",ICASE Presidential Scholarship,12-30-2024
205,"$2,500",Orchard Scholarship for Women of Color in STEM,12-31-2024
205,"$5,000",Bonnie Fang Nursing Scholarship,12-31-2024
205,"$1,000",Estelle R. Ford Future Nurses Scholarship,12-31-2024
205,"$1,000",York County Conservation District Scholarship,12-31-2024
205,"$2,000",Pennsylvania Psychological Foundation Education Award,12-31-2024
205,"$20,000",Voices of America Scholarship,12-31-2024
205,"$5,000",Dr. Nicholas Vacc Scholarship,12-31-2024
205,"$8,000",NBCC Foundation Military Scholarship,12-31-2024
205,Varies,Climate Adaptation Scientists of Tomorrow Program,12-31-2024
205,"$1,000","$1,000 UI/UX WorkForce Institute Scholarship",12-31-2024
205,"$8,000",NBCC Foundation Rural Scholarship,12-31-2024
205,"$2,500",Gorilla Webtactics Entrepreneurial Law Student Scholarship,12-31-2024
205,"$2,500",Charles E. Peterson Prize Fellowship,12-31-2024
205,"$1,000",Apprentice Ecologist Scholarship,12-31-2024
205,"$2,500",Goodyear STEM Career Day Scholarships,12-31-2024
205,"$1,000",Maodong Xu Science & Technology Scholarship,12-31-2024
205,"$2,500",Instant Checkmate’s Law and Legal Studies Scholarship,12-31-2024
206,"$1,000",A1 Solar Scholarship,01-01-2025
206,Varies,Thomas G. Labrecque Smart Start Scholarship Program,01-01-2025
206,"$1,000",MIT THINK Out of the Box Scholars Program,01-01-2025
206,"$1,000",Eleanor Wegg Poetry Scholarship,01-01-2025
207,"$2,500",Lois Britt Memorial Pork Industry Scholarship,01-02-2025
207,"$150,000",Knowles Teaching Fellows Program,01-02-2025
207,"$6,000",WTS Portland Chapter Gail Achterman Leadership Scholarship,01-02-2025
208,Varies,Kinsey Determination Scholarship for the College of Business,01-03-2025
209,"$20,000",APHA Kaiser Permanente Community Health Scholarship,01-04-2025
210,"$26,000",AMS Graduate Fellowships,01-05-2025
210,"$203,152",GHR Fellows Scholarship,01-05-2025
210,"$10,000",Farm Credit Foundation for Agricultural Advancement Scholarship,01-05-2025
210,"$60,000",University of Rochester First Robotics Scholarship,01-05-2025
211,"$2,500",Partstack Future Leaders in Engineering Scholarship,01-06-2025
212,"$2,500",Harlem YMCA bai Corporate Scholarship Award,01-07-2025
212,"$30,000",Scholarship for Diversity in Media,01-07-2025
212,"$30,000",Jim Borden Memorial Scholarship,01-07-2025
213,"$6,500",NJCPA College Scholarships,01-08-2025
215,"$25,000",ARRL Foundation Scholarship Programs,01-10-2025
215,"$1,000",ARRL Charles Clarke Cordle Memorial Scholarship,01-10-2025
215,"$8,000",Jonathan Baldwin Turner Scholarships,01-10-2025
216,"$10,000",FFA Future Leaders Scholarship,01-11-2025
216,"$1,500",Grow Ag Leaders Scholarship,01-11-2025
216,"$10,000",RTDNA Foundation Ed Bradley Scholarship,01-11-2025
216,"$2,000",RTDNF Carole Simpson Scholarship,01-11-2025
216,"$10,000",RTDNA Scholarships & Fellowships,01-11-2025
216,"$1,000",RTDNF Mike Reynolds Scholarship,01-11-2025
216,"$2,000",RTDNF Pete Wilson Scholarship,01-11-2025
216,"$2,500",RTDNF Presidents Scholarships,01-11-2025
216,"$2,000",RTDNA Lee Thornton Scholarship,01-11-2025
216,"$6,000",RTDNA George Foreman Tribute to Lyndon B. Johnson Scholarship,01-11-2025
217,"$2,000",E J Josey Scholarship Award Committee of the Black Caucus,01-12-2025
217,"$6,000",ACEC Colorado Scholarship & Education Foundation Scholarships,01-12-2025
217,"$3,000",James F. Reville Scholarship,01-12-2025
217,"$30,000",Samuel Huntington Public Service Award,01-12-2025
217,"$30,000",The Woodrow Wilson Indiana Teaching Fellowship,01-12-2025
217,"$3,000",The Arc New York Scholarships,01-12-2025
218,"$9,000",The Lyons Aviation Foundation Scholarship,01-13-2025
220,Varies,James H. Davis Scholarship,01-15-2025
220,"$20,000",John Lennon Scholarships,01-15-2025
220,"$20,000",BMI Composer Awards,01-15-2025
220,"$23,000",TEDS PhD Program Scholarship,01-15-2025
220,"$10,000",TEDS PhD Merit Scholarship,01-15-2025
220,"$88,000",Center for Women In Technology (CWIT) Scholars Program at UMBC,01-15-2025
220,"$20,000",PIMCO Future Leaders Scholarship (Undergraduate),01-15-2025
220,"$3,500",OSCPA Oregon University & Community College Scholarships,01-15-2025
220,"$3,000",MSSA Scholarship Program,01-15-2025
220,"$60,000",Furman University Wylie Math Scholarship,01-15-2025
220,"$2,500",The Ocean Foundation Boyd N. Lyon Scholarship,01-15-2025
220,"$5,000",Buildgirls Scholars Program,01-15-2025
220,"$5,000",GWCF National Scholarship Competition,01-15-2025
220,"$266,160",Ithaca College Park Scholar Award,01-15-2025
220,"$5,000",Garden Club of America's Coastal Wetland Studies Award,01-15-2025
220,"$4,000",Garden Club of America Centennial Pollinator Fellowship,01-15-2025
220,"$4,000",SDSWMA Scholarship Program,01-15-2025
220,Varies,National Horticulture Foundation Scholarships,01-15-2025
220,"$20,000",TEDS PhD G. Walter Hansen Fellowship,01-15-2025
220,$500,East Rock Films Scholarship,01-15-2025
220,Varies,Kenneth H. Ashworth Fellowship Program,01-15-2025
220,"$17,500",Valparaiso University Allen Scholarship,01-15-2025
220,"$25,000",Gustave Blache III Art Scholarships for Aspiring Artists,01-15-2025
220,"$3,000",BWI Active Interest Media Boating Journalist Scholarship,01-15-2025
220,"$2,750",The Cloisters Summer Internship Program for College Students,01-15-2025
221,"$40,000",Essential Visionaries Scholarship Fund,01-16-2025
221,"$60,000",Creative Writing Scholarship,01-16-2025
221,"$50,000",JCB Fellowship Program,01-16-2025
222,"$10,000",DEWALT Trades Scholarship,01-17-2025
222,Varies,DOE Computational Science Graduate Fellowship,01-17-2025
223,"$10,000",Kristy J. Hendrickson Scholarship,01-18-2025
224,Varies,Judy Corman Memorial Scholarship and Internship from Scholastic,01-19-2025
224,"$15,000",ISI Henry Salvatori Fellowship,01-19-2025
224,Varies,New York Women in Communications Scholarships,01-19-2025
224,"$10,000",NYWICI Scholarship Program,01-19-2025
224,"$55,000",Micron Science and Technology Scholars Program,01-19-2025
224,"$20,000",Architecture Foundation Diversity Advancement Scholarship,01-19-2025
224,"$15,000",ISI Richard M. Weaver Fellowship,01-19-2025
224,"$3,000",AAMI Foundation Michael J. Miller Scholarship,01-19-2025
224,"$20,000",Advanced Energy's STEM Diversity Scholarship,01-19-2025
224,"$10,000",MALDEF Law School Scholarship Program,01-19-2025
225,"$4,500",Frank M. Snowden Jr. Undergraduate Scholarships,01-20-2025
225,"$2,000",SDES Eastern Chapter Scholarships,01-20-2025
225,"$4,000",Florida Retired Educators Foundation Scholarship,01-20-2025
225,"$10,000",Westmont Scholarships for Computer Science Majors,01-20-2025
225,$500,ACF Red Baucher Scholarship Fund,01-20-2025
226,"$1,000",Jay Holstine Scholarship,01-21-2025
227,"$10,000",National Forum for Black Public Administrators Scholarship,01-22-2025
227,"$37,000",The Kress Foundation Conservation Fellowships,01-22-2025
228,"$50,000",Edison Scholars Program,01-23-2025
228,"$2,500",Quad City Engineering and Science Council Scholarship (QCESC),01-23-2025
228,"$80,000",College of Saint Mary Marie Curie Scholarship,01-23-2025
229,$800,Sue Dilts Memorial Art Scholarship,01-24-2025
229,"$3,000",Anna Frutiger Memorial Scholarship,01-24-2025
229,"$1,000",Loren and Becky Roslund Scholarship,01-24-2025
229,"$25,000",Boren Fellowships,01-24-2025
229,"$50,000",Microsoft Imagine Cup,01-24-2025
231,"$10,000",Clarkston Scholars Scholarship,01-26-2025
231,Varies,Scholarships for Woodworking Manufacturing Students,01-26-2025
231,"$110,000",ACEC California Scholarship,01-26-2025
231,"$10,000",Max J. Madrid Law Diversity Scholarship,01-26-2025
231,"$10,000",Clarkston Scholars Program,01-26-2025
231,"$1,000",Doreen Montalvo 'Do It Anyway' Scholarship,01-26-2025
231,"$2,000",Des Moines Women's Club Literature Scholarship,01-26-2025
231,"$15,000",R. Gene and Nancy D. Richter Foundation,01-26-2025
231,"$4,000",DSEA Christopher K. Smith Memorial Future Teacher Scholarship,01-26-2025
231,"$2,500",Truman D. Picard Scholarship,01-26-2025
231,"$64,597",NLM Associate Fellowship Program,01-26-2025
232,"$60,000",Robert A and Sandra S Borns Jewish Studies Program Scholarships,01-27-2025
232,"$15,000",Barry M. Goldwater Scholarship & Excellence in Education Foundation,01-27-2025
233,"$5,000",Society of Women Engineers - Lehigh Valley Section,01-28-2025
234,"$40,000",Penn State Braddock Scholarship,01-29-2025
234,"$140,576",Greehey Scholars Program,01-29-2025
235,Varies,JPMorgan Chase Thomas G. Labrecque Smart Start Program,01-30-2025
236,"$2,000",Mildred Nutting Nursing Scholarship,01-31-2025
236,"$9,240",Hoeks Family Scholarship,01-31-2025
236,"$4,600",Gordon and Eleanor Spykman Memorial Scholarship,01-31-2025
236,"$10,000",CXR Foundation Scholarship,01-31-2025
236,"$2,000",DAR Occupational/Physical Therapy Scholarship,01-31-2025
236,"$1,000",Mary Lily Research Grants,01-31-2025
236,"$3,400",Dr. and Mrs. William J. Yonker Scholarship,01-31-2025
236,Varies,LeRoy W. Homer Jr. Scholarship,01-31-2025
236,"$20,000",ASA Minority Fellowship Program,01-31-2025
236,Varies,Animal Care PA's Veterinary Student Scholarship,01-31-2025
236,"$10,000",LPGA Chevron Changing the Face of Golf Scholarship,01-31-2025
236,"$40,000",HBCU Week x FOSSI STEM Scholarship,01-31-2025
236,"$5,000",Amtrak Academic Scholarship,01-31-2025
236,"$10,000",Licensing International’s Scholarship Program,01-31-2025
236,"$5,000",Mister Rogers Memorial Scholarship,01-31-2025
236,"$2,500",Madeline Pickett Cogswell Nursing Scholarship,01-31-2025
236,"$8,000",APS/IBM Research Internship for Undergraduate Women,01-31-2025
236,Varies,Choose Ohio First STEMM Scholarship,01-31-2025
236,"$1,000",Keep Iowa Beautiful Scholarships,01-31-2025
236,"$20,000",Melvin Kruger Endowed Scholarship Program,01-31-2025
236,"$16,000",DAR Leo W. and Alberta V. Thomas Utz Scholarship - Math,01-31-2025
236,"$5,000",NAMIC Mutual Insurance Foundation Scholarship Program,01-31-2025
236,"$20,000",DAR Alice W. Rooke Scholarship,01-31-2025
236,"$20,000",DAR Dr. Francis Anthony Beneventi Medical Scholarship,01-31-2025
236,"$1,000","$1,000 Digital Marketing WorkForce Institute Scholarship",01-31-2025
236,"$5,000",Cherry Hawk Scholarship,01-31-2025
236,"$2,500",PRSA Chicago Michelle Flowers Diversity Fellowship Program,01-31-2025
236,"$2,000",William B. Ruggles Journalist Scholarship,01-31-2025
236,Varies,Irene and Daisy MacGregor Memorial Scholarship,01-31-2025
236,"$30,000","Sidney B. Williams, Jr. Scholar Program",01-31-2025
236,"$2,000",DAR Arthur Lockwood Beneventi Law Scholarship,01-31-2025
236,"$6,000",CLOC Scholarship,01-31-2025
236,"$5,000",Leslie Andree Hanna Medical Scholarship,01-31-2025
236,"$3,000",Student Excellence in Archaeology Scholarships,01-31-2025
236,"$10,000",SAA Native American Scholarships,01-31-2025
236,"$2,500",Matthew Tobin Cappetta Archaeological Scholarship,01-31-2025
236,"$2,000",Mary Elizabeth Lockwood Beneventi MBA Scholarship,01-31-2025
236,"$20,000",Nellie Love Butcher Music Scholarship,01-31-2025
236,"$10,000",Herb Society of America Research Grant,01-31-2025
236,"$2,500",DAR Caroline E. Holt Nursing Scholarship,01-31-2025
236,"$4,000",Kent and Carolyn Hojem Music Scholarship,01-31-2025
236,Varies,Texas- UK Award,01-31-2025
236,"$3,000",Michael T. and Mary L. Cloyd Scholarship,01-31-2025
236,"$25,000",Boren Scholarships,01-31-2025
236,"$2,500",DAR Centennial Scholarship,01-31-2025
236,"$20,000",Harry Hampton Fund Scholarship,01-31-2025
236,"$1,000",IWEA Clean Water Scholarship,01-31-2025
236,"$1,000",Clean Water Scholarship - IWEA,01-31-2025
236,"$40,000",Next Generation Hoosier Educators Scholarship,01-31-2025
236,"$5,000",Michigan Council of Women in Technology Scholarship,01-31-2025
236,Varies,Cheryl L. Wase Memorial Scholarship for the Study of Archaeology,01-31-2025
236,"$10,000",NANOG Scholarship Program,01-31-2025
236,"$2,500",The Robert B. Oliver ASNT Scholarships,01-31-2025
236,"$2,000",The Lucinda Beneventi Findley History Scholarship,01-31-2025
236,$500,IWEA Environmental Career Scholarship,01-31-2025
236,"$8,000",DAR Dr. Aura-Lee A. & James Hobbs Pittenger American History Scholarship,01-31-2025
236,"$1,500",ICAFS Undergraduate Student Scholarship,01-31-2025
236,"$2,000",ICAFS Susan B. Martin Scholarship,01-31-2025
236,$500,ICAFS High School Scholarship,01-31-2025
236,"$1,500",ICAFS Graduate Scholarship,01-31-2025
236,"$10,000",Iowa Farm Bureau Scholarships,01-31-2025
236,"$1,500",Behavior Frontiers Helen Mader Scholarship,01-31-2025
236,"$1,000",Minority Natural Resource Scholarship,01-31-2025
236,"$2,000",William Robert Findley Graduate Chemistry Scholarship,01-31-2025
236,"$1,200",Sophie and Hans Scholl Memorial Scholarship,01-31-2025
236,"$3,000",Fair Chance Trade School Scholarship,01-31-2025
236,"$1,500",DAR Edward G. and Helen A. Borgens Teacher Scholarships,01-31-2025
236,"$19,000",Ernest F. Hollings Undergraduate Scholarship,01-31-2025
236,"$5,000",Enid Hall Griswold Memorial Scholarship,01-31-2025
236,Varies,WSU Arthur and Doreen Parrett Scholarship,01-31-2025
236,"$1,000",Applegate Jackson Parks Future Teacher Scholarship,01-31-2025
236,"$6,000","Material Handling Education Foundation, Inc. Scholarship",01-31-2025
236,"$5,000",LNESC Ford Driving Dreams Scholarship,01-31-2025
236,"$2,000",Brake It Down Scholarship,01-31-2025
236,"$20,000",ASNT Fellowship Award,01-31-2025
236,"$1,000",Charles P. Bell Scholarships and Grants,01-31-2025
236,"$5,000",Sport Clips Scholarship,01-31-2025
236,"$3,000",ASNT Engineering Undergraduate Scholarship,01-31-2025
236,"$45,000",EPP/MSI Undergraduate Scholarship Program,01-31-2025
236,"$10,000",Toshiba/NSTA ExploraVision Science Competition,01-31-2025
236,"$5,000",MHI Howard Bernstein Scholarship Fund,01-31-2025
237,Varies,JSU Alabama Curley Memorial Scholarship,02-01-2025
237,"$10,000",Mycological Society of America Awards,02-01-2025
237,"$1,500",Ruth K. Jacobs Memorial Scholarship,02-01-2025
237,Varies,JSU Mildred L. Sheppard Scholarship,02-01-2025
237,"$2,000",SWSIS Scholarships for Women Studying Information Security,02-01-2025
237,Varies,Anthony and Charlotte Kinney Scholarship,02-01-2025
237,Varies,Charles Lee Anderson Memorial Scholarship,02-01-2025
237,"$105,000",Abdul Waheed Scholarship in Biochemistry,02-01-2025
237,Varies,GCFM Horticulture Scholarship,02-01-2025
237,Varies,Carolyn Wones Scholarship,02-01-2025
237,Varies,Beta Gamma Recruitment Grant,02-01-2025
237,"$4,000",APS Undergraduate Summer Research Fellowship,02-01-2025
237,Varies,Billy Smith Memorial Scholarship,02-01-2025
237,Varies,Alpha Delta Kappa XI Education Scholarship,02-01-2025
237,"$8,000",Beatrice F. Kroesche Memorial Scholarship,02-01-2025
237,"$1,000",High School Senior Scholarship for Future Teachers,02-01-2025
237,"$4,600",ASPET Summer Undergraduate Research Fellow (SURF) Individual Awards,02-01-2025
237,Varies,JSU Alabama Four Year Communications Scholarship,02-01-2025
237,"$5,000",John F. and Anna Lee Stacey Scholarship Fund,02-01-2025
237,"$1,000",Jean Lee/Jeff Marvin Collegiate Scholarship,02-01-2025
237,Varies,Wisconsin Professional Police Association Scholarship Program,02-01-2025
237,Varies,JSU Alabama Moersch Scholarship,02-01-2025
237,"$200,000",Mercatus Center PhD Fellowship,02-01-2025
237,Varies,Oregon Barber and Hairdresser Grant Program,02-01-2025
237,Varies,JSU Alabama Jeff Parker Scholarship,02-01-2025
237,Varies,JSU Alabama Power Scholarship,02-01-2025
237,Varies,Janet L. Williams Mathematics Scholarship,02-01-2025
237,"$118,200",Post University Malcolm Baldrige Scholarship,02-01-2025
237,"$1,500",Southwest Georgia Farm Credit Scholarship,02-01-2025
237,"$3,500",Candace Mast Veterinary Medicine Scholarship,02-01-2025
237,"$1,000",David A. Hicks Memorial Scholarship,02-01-2025
237,"$4,000",NGC Scholarship,02-01-2025
237,Varies,"Federated Garden Clubs of Maryland, Inc. Scholarships",02-01-2025
237,Varies,Col. Robert P. Moore Scholarship,02-01-2025
237,"$10,000",PHAM For Love of Country Scholarship,02-01-2025
237,"$50,000",Young Epidemiology Scholars Competition,02-01-2025
237,"$2,000",Duane Watson Scholarship for Exceptional Character in Agriculture,02-01-2025
237,"$40,000",ASFPM Foundation Future Leaders Scholarship,02-01-2025
237,Varies,CFPCA LGBT Endowed Scholarship,02-01-2025
237,"$12,000",UMW DI Emerick Scholarship,02-01-2025
237,"$20,000",Notre Dame of Maryland University Art Scholarship Competition,02-01-2025
237,Varies,JSU Lovett Scholarship,02-01-2025
237,Varies,JSU Julian Jenkins Scholarship,02-01-2025
237,"$25,000",Henry David Thoreau Scholarship Program,02-01-2025
237,"$1,000",Alys Robinson Stephens Performing Arts Scholarship,02-01-2025
237,Varies,American Dance Festival Internships,02-01-2025
237,Varies,Brig Gen Robert B. and Judith Maguire Scholarship,02-01-2025
237,Varies,NAJA Scholarships,02-01-2025
237,"$4,000",UMW Helm Memorial Scholarship,02-01-2025
237,"$3,000",Martin's Famous Potato Rolls and Bread Video Scholarship,02-01-2025
237,Varies,JSU Alabama Theatre and Film Scholarships,02-01-2025
237,Varies,Admiral Ronald J. Hays Scholarship,02-01-2025
237,"$10,300",Legacy Scholarship Program,02-01-2025
237,"$40,000",KPMG Future Leaders Program,02-01-2025
237,Varies,UMW Jane Buttrey Scholarship,02-01-2025
237,Varies,JSU Alabama Bush Memorial Scholarship,02-01-2025
237,Varies,Association for Women in Mathematics Essay Contest,02-01-2025
237,"$1,000",Frank Der Yuen Aviation Scholarship,02-01-2025
237,"$20,000",CIEF Scholarships in Architecture,02-01-2025
237,Varies,Betty Harlan Memorial Art Scholarship,02-01-2025
237,"$10,000",ZGF Scholarships,02-01-2025
237,"$4,000",JVS Chicago Scholarship Program,02-01-2025
237,"$25,000",IEEE Life Member History Fellowship,02-01-2025
237,"$20,000",SME Education Foundation Scholarships,02-01-2025
237,"$20,000",Dr. Omega Logan Silva Scholarship,02-01-2025
237,"$3,000",P.J.C. Lindfors Legal Scholarship,02-01-2025
237,"$6,000",ABF Summer Undergraduate Research Fellowship,02-01-2025
238,"$7,500",Richard J. Bea Nursing Scholarship,02-02-2025
238,"$13,500",DHS Summer Research Team Program for Minority Serving Institutions,02-02-2025
238,Varies,LRAEF Scholars Program,02-02-2025
238,Varies,James M. & Erma T. Freemont Scholarship Program,02-02-2025
238,"$5,000",Health Tech Scholarship,02-02-2025
239,"$5,000",AMS Freshman Undergraduate Scholarship,02-03-2025
239,"$131,600",Carson-Newman Tarr Full-Tuition Music Scholarship,02-03-2025
241,"$7,000",NMF Primary Care Leadership Program,02-05-2025
241,"$2,000",Dallas Hispanic Law Foundation Scholarship,02-05-2025
241,"$5,000",Bernard Kilgore Memorial Scholarship,02-05-2025
241,"$5,000",ACECNJ Scholarship,02-05-2025
